Fecha_de_publicacion,Nombre_del_producto,Categoria,Subcategoria,Codigo_del_producto,URL,Precio_publicado,Precio_regular,Stock,Descripcion
2023-05-29T00:00:00Z,Antena de exterior TDA para TV digital SV9453,/Tecnología/TV Y VIDEO/ACCESORIOS DE TV Y VIDEO/,/Tecnología/TV Y VIDEO/,357599,https://www.hiperlibertad.com.ar/antena-de-exterior-tda-para-tv-digital-sv9453/p,6859.0,6859.0,2.0,Antena de exterior TDA para TV digital SV9453
2023-05-29T00:00:00Z,Antena digital externa DA-220c,/Tecnología/TV Y VIDEO/ACCESORIOS DE TV Y VIDEO/,/Tecnología/TV Y VIDEO/,387651,https://www.hiperlibertad.com.ar/antena-digital-externa-da-220c/p,2884.99,5769.0,3.0,Antena digital externa DA-220cCon cable - Canales 21-69 - Ganancia 11-13dB - Longitud 1020mm
2023-05-29T00:00:00Z,PACK ANTENA DIRECTV 0.60 FULL,/Tecnología/TV Y VIDEO/ACCESORIOS DE TV Y VIDEO/,/Tecnología/TV Y VIDEO/,282556,https://www.hiperlibertad.com.ar/kit-antena-directv-prepago-60-cm/p,2999.0,5999.0,12.0,
2023-05-29T00:00:00Z,"SMART 50"" RCA AND50P6UHD ANDROID",/Tecnología/TV Y VIDEO/TV LED Y SMART TV/,/Tecnología/TV Y VIDEO/,505290,https://www.hiperlibertad.com.ar/smart-50-rca-and50p6uhd-androi/p,114999.0,114999.0,1.0,"<p>Un mundo de entretenimiento. Con la ayuda de Google, explora el contenido de todas tus aplicaciones, organizado de forma inteligente solo para vos. Google TV se basa en lo que has visto para recomendarte qu&eacute; disfrutar a continuaci&oacute;n.</p> <ul> <li>Google Play</li> <li>Chromecast Integrado</li> <li>Google Assistant</li> <li>Dolby Audio</li> </ul> <ul class=""no-list product-specification-list clearfix""> <li> <h3>Especificaciones t&eacute;cnicas</h3> <ul class=""no-list product-specification-sublist""> <li>Entradas:</li> <li>1 RF (75 ohms) Antena/Cable</li> <li>1 Video AV</li> <li>1 Audio R/L</li> <li>3 HDMI</li> <li>1 USB</li> <li>1 LAN</li> <li>Salidas:</li> <li>1 Auricular</li> <li>1 Audio S/PDIF &Oacute;ptica ( Audio Digital)</li> <li>Tensi&oacute;n de alimentaci&oacute;n:</li> <li>100-240V~ 50/60Hz 50W</li> </ul> </li> <li> <h3>Im&aacute;gen</h3> <ul class=""no-list product-specification-sublist""> <li>Diagonal Pantalla: 50""</li> <li>Resoluci&oacute;n (pixeles) 3840&times;2160</li> </ul> </li> <li> <h3>Sonido</h3> <ul class=""no-list product-specification-sublist""> <li>Parlantes Integrados 2</li> <li>Potencia de salida de audio 2 x 9.5 Watts</li> <li>Sistema de sonido MTS (ESTEREO/MONO/SAP)</li> </ul> </li> <li> <h3>Accesorios</h3> <ul class=""no-list product-specification-sublist""> <li>Manual con Garant&iacute;a : Si</li> <li>Control remoto Infrarojo : Si</li> <li>Tornillos : Si</li> <li>Cable alimentaci&oacute;n : Si</li> <li>Soporte base : Si</li> <li>Cable adaptador de se&ntilde;al:Si</li> </ul> </li> <li> <h3>Medidas</h3> <ul class=""no-list product-specification-sublist""> <li>Medidas con soporte de mesa:</li> <li>Ancho (cm.) 111,2</li> <li>Alto (cm.) 70,0</li> <li>Profundidad (cm.) 26,5</li> <li>Peso (kg.) 8,4</li> </ul> </li> </ul>"
2023-05-29T00:00:00Z,SMART LED TV LG 50 PULGADAS 4K UHD 50UQ8050PSB,/Tecnología/TV Y VIDEO/TV LED Y SMART TV/,/Tecnología/TV Y VIDEO/,504028,https://www.hiperlibertad.com.ar/smart-50-lg-50uq8059/p,166249.05,184999.0,6.0,"<p>&nbsp;</p> <div class=""more-box""> <p cong="""" style=""text-align: center;""><strong>Caracter&iacute;sticas principales</strong></p> </div> <div class=""expand-layer"" aria-expanded=""false""> <div class=""feature-list-box""> <ul class=""feature-list on""> <li style=""text-align: left;"">Panel 4K UHD</li> <li style=""text-align: left;"">4K Procesador Inteligente &alpha;5 generaci&oacute;n 5</li> <li style=""text-align: left;"">4K Active HDR</li> <li style=""text-align: left;"">Ultra Surround</li> <li style=""text-align: left;"">LG ThinQ AI: Inteligencia Artificial</li> <li style=""text-align: left;"">Procesador4K Procesador Inteligente &alpha;5 generaci&oacute;n 5</li> <li style=""text-align: left;"">Resoluci&oacute;n3840 x 2160</li> <li style=""text-align: left;"">Inteligencia artificial S&iacute;: LG ThinQ AI</li> <li style=""text-align: left;"">MEDIDAS TV CON BASE: Alto: 71.3 cm - Ancho: 112.1 cm - Profundidad: 23.1 cm</li> <li style=""text-align: left;"">MEDIDAS TV SIN BASE: Alto: 65.1 cm - Ancho: 112.1 cm - Profundidad: 5.71 cm</li> <li style=""text-align: left;"">PESO: Con base: 11.9 Kg - Sin base: 11.7 Kg</li> </ul> </div> </div> <p></p>"
2023-05-23T00:00:00Z,"SMART TV 43"" PULGADAS PHILIPS FHD BLANCO 43PFD6927",/Tecnología/TV Y VIDEO/TV LED Y SMART TV/,/Tecnología/TV Y VIDEO/,492247,https://www.hiperlibertad.com.ar/smart-tv-43-pulgadas-philips-fhd-blanco-43pfd6927/p,115999.0,174169.0,5.0,"<p style=""text-align: center;"">&nbsp; &nbsp; &nbsp; &nbsp; &nbsp; &nbsp;Este televisor Philips de 43"" color blanco encaja a la perfecci&oacute;n en cualquier parte. Las im&aacute;genes son n&iacute;tidas; el sonido, claro; y encima es inteligente: Android TV de Philips.</p><div class=""p-chapter-container""><dl class=""p-s08__main-list""><dd><div class=""p-body-copy-02 ""><dl class=""p-s08__main-list""><dd><div class=""p-body-copy-02 ""><p style=""text-align: center;""><br /><strong>Compacto y elegante.</strong><br /><br /><strong>Android TV LED FHD</strong></p><p style=""text-align: center;""><strong>108 cm (43"")</strong><br /><strong>Sonido Dolby Atmos</strong><br /><strong>Android/Control por voz con IA</strong><br /><strong>Control por voz. </strong><br /><strong>El Asistente de Google.</strong></p><p style=""text-align: center;"">Admite barras de sonido compatibles con Dolby Atmos.</p><p style=""text-align: center;"">Sencillamente inteligente. Android TV.</p><h3 style=""text-align: center;"">Especificaciones t&eacute;cnicas</h3><p style=""text-align: center;""><strong>Imagen / pantalla</strong><br /><strong>Pantalla</strong></p><p style=""text-align: center;"">Resoluci&oacute;n de panel 1920 x 1080p<br />Relaci&oacute;n de aspecto 16:9<br />Optimizaci&oacute;n de la imagen<br />HDR10<br />HLG (Hybrid Log Gamma)<br />Pixel Plus alta definici&oacute;n<br />Tama&ntilde;o diagonal de pantalla (pulgadas) 43<br />Tama&ntilde;o de pantalla en diagonal (m&eacute;trico) 108<br /><br /><strong>Sintonizador/recepci&oacute;n/transmisi&oacute;n</strong></p><p style=""text-align: center;"">Compatibilidad con MPEG<br />MPEG2<br />MPEG4<br />Reproducci&oacute;n de video<br />PAL<br />SECAM<br />NTSC<br />Gu&iacute;a de programaci&oacute;n de televisi&oacute;n*<br />Gu&iacute;a electr&oacute;nica de programaci&oacute;n de 8 d&iacute;as<br />TV digital<br />ISDB-T<br />Compatibilidad HEVC S&iacute;<br /><br /><strong>Conectividad</strong></p><p style=""text-align: center;"">Cantidad de conexiones HDMI 3<br />Cantidad de puertos USB 2<br />Otras conexiones<br />Salida de auriculares<br />Antena IEC75<br />Conector de servicio<br />Salida de audio digital (&oacute;ptica)<br />Ethernet-LAN RJ-45<br />Conexi&oacute;n inal&aacute;mbrica<br />Bluetooth 5.0<br />Wi-Fi 802.11n, 2x2, doble banda<br />Funciones HDMI<br />Audio Return Channel<br />EasyLink (HDMI-CEC)<br />Reproducci&oacute;n con un solo bot&oacute;n<br />Control remoto de gran alcance<br />Control de audio del sistema<br />Modo de espera del sistema<br />HDCP 2.3<br />S&iacute; en todas las conexiones HDMI<br />HDMI ARC<br />S&iacute;, en la conexi&oacute;n HDMI1<br />Salida de sonido digital SPDIF<br />1 (&oacute;ptica)<br /><br /><strong>Aplicaciones multimedia</strong></p><p style=""text-align: center;"">Formatos de reproducci&oacute;n de video<br />Contenedores: AVI, MKV<br />H264/MPEG-4 AVC<br />MPEG-1<br />MPEG-2<br />MPEG-4<br />VP9<br />AV1<br />HEVC (H.265)<br /><strong>Formatos de subt&iacute;tulos compatibles</strong><br />.SMI<br />.SRT<br />.SUB<br />.TXT<br />.ASS<br />.SSA<br /><strong>Formatos de reproducci&oacute;n de m&uacute;sica</strong><br />AAC<br />MP3<br />WAV<br />WMA (v2 hasta v9.2)<br />WMA-PRO (v9 y v10)<br /><br /><strong>Formatos de reproducci&oacute;n de imagen</strong><br />JPEG<br />GIF<br />PNG<br />HEIF<br />BMP<br /><br /><strong>Alimentaci&oacute;n</strong><br />CA 110-240 V 50/60 Hz<br />Consumo de energ&iacute;a en modo de espera<br />&lt;0,5W<br />Temperatura ambiente<br />5 &deg;C a 35 &deg;C<br />Funciones de ahorro de energ&iacute;a<br />Timer de apagado autom&aacute;tico<br />Modo ecol&oacute;gico<br />Sensor de luz<br />Silenciamiento de imagen (para radio)<br /><br /><strong>Sonido</strong></p><p style=""text-align: center;"">Potencia de salida (RMS)<br />16 W<br />Configuraci&oacute;n del parlante<br />Altavoz de 8 W x2<br />Optimizaci&oacute;n del sonido<br />Nivelador autom&aacute;tico de volumen<br />Di&aacute;logo n&iacute;tido<br />Dolby Atmos<br />Mejora de graves Dolby<br /><br /><strong>Dimensiones</strong></p><p style=""text-align: center;"">Ancho de la caja 1070<br />Altura de la caja 650<br />Profundidad de la caja 140<br />Ancho del equipo 958<br />Altura del equipo 568<br />Profundidad del equipo 82<br />Ancho del producto (con soporte) 958<br />Altura del producto (con soporte) 587<br />Profundidad del producto (con soporte) 227<br />Peso del producto 7,2<br />Peso del producto (+ soporte) 7,13<br />Peso con embalaje incluido 9,4<br />Compatible con soporte de pared 100 x 200 mm<br /><br /><strong>Accesorios</strong></p><p style=""text-align: center;"">Accesorios incluidos<br />2 pilas AAA<br />Cable de alimentaci&oacute;n<br />Gu&iacute;a de inicio r&aacute;pida<br />Folleto legal y de seguridad<br />Soporte para la mesa<br />Control remoto<br /><br /><strong>Android TV</strong></p><p style=""text-align: center;"">Sistema operativo<br />Android TV&trade; 10 (Q)<br />Aplicaciones preinstaladas<br />YouTube<br />Amazon Prime Video<br />Disney+<br />Google Play Movies<br />Google Play Music<br />B&uacute;squeda de Google<br />YouTube Music<br />Netflix<br />Tama&ntilde;o de la memoria (flash) 8 GB</p></div></dd></dl></div></dd></dl></div><p style=""text-align: center;""><span>&nbsp;</span></p>"
2023-05-24T00:00:00Z,SMART TV 55 PULGADAS SAMSUNG QLED UHD 4K Q65BA,/Tecnología/TV Y VIDEO/TV LED Y SMART TV/,/Tecnología/TV Y VIDEO/,506065,https://www.hiperlibertad.com.ar/smart-tv-55-pulgadas-samsung-qled-uhd-4k-q65ba/p,346999.0,346999.0,1.0,SMART TV 55 PULGADAS SAMSUNG QLED UHD 4K Q65BA
2023-05-23T00:00:00Z,SMART TV ANDROID PHILIPS 50 PULGADAS 4K UHD 50PUD7406/77,/Tecnología/TV Y VIDEO/TV LED Y SMART TV/,/Tecnología/TV Y VIDEO/,482038,https://www.hiperlibertad.com.ar/smart-50-philips-50pud7406-77/p,164863.2,206079.0,8.0,"<p style=""text-align: center;""><strong>Sistema Operativo Android 10</strong><br /><strong>Modelo 50PUD7406/77&nbsp;</strong><br />Control por voz con el Asistente de Google.<br />HDR para im&aacute;genes brillantes.<br />Dise&ntilde;o atractivo y ultra fino, con marco negro mate Dolby Vision y Dolby Atmos para visi&oacute;n y sonido cinematogr&aacute;fico.<br />Se puede personalizar la pantalla de inicio para mostrar las apps preferidas, facilitando la reproducci&oacute;n de las pel&iacute;culas y los programas favoritos<br />Ideal para jugar con cualquier consola gracias a su bajo tiempo de latencia<br />Garant&iacute;a: 1 a&ntilde;o <br />Origen: Argentina.<br /><br /><strong>CARACTER&Iacute;STICAS DE PANTALLA</strong><br />Pulgadas 50<br />Resoluci&oacute;n De Video 4K Ultra HD<br />Resoluci&oacute;n 3840x2160<br />Radio De Aspecto 16:9<br />Tipo de TV Smart TV<br /><br /><strong>FUNCIONES ESPECIALES</strong><br />Smart Tv Si<br />Youtube Si<br />Netflix Si<br /><br /><strong>SONIDO</strong><br />Parlantes 2<br />Potencia De Parlantes 20 W<br /><br /><strong>CONECTIVIDAD</strong><br />Puerto Ethernet Si<br />Salida Para Auriculares Si<br />Bluetooth Si<br />Entradas Hdmi 4<br />Entradas Usb 2<br />OBSERVACIONES<br />Garantia 12 Meses<br /><br /><strong>PANTALLA</strong><br />Tipo De Pantalla LED<br /><br /><strong>DIMENSIONES</strong><br />Ancho 111.3 Cm<br />Profundidad 8.7 Cm<br />Alto 64.7 Cm<br /><br /><strong>DIMENSIONES (CON BASE)</strong><br />Alto (con Base) 67 Cm<br />Ancho (con Base) 111 Cm<br />Profundidad (con Base) 24.8 Cm</p>"
2023-05-23T00:00:00Z,SMART TV ANDROID PHILIPS 55 PULGADAS 4K UHD 55PUD7406/77,/Tecnología/TV Y VIDEO/TV LED Y SMART TV/,/Tecnología/TV Y VIDEO/,480334,https://www.hiperlibertad.com.ar/smart-55-philips-55pud7406-77/p,193591.2,241989.0,1.0,"SMART TV 4K CON ANDROID 55"" 55PUD7406 PHILIPS - Pantalla LED 55"" 4K UHD (3840x2160) 16:9 - Procesamiento Quad Core - Android TV - WiFi 802.11n 2x2 - Bluetooth 5.0 - 4 HDMI - 2 USB - Salida de audio digital (óptica) - Ethernet-LAN RJ-45 - Salida de auriculares - Entrada I/D de audio - Potencia de salida de sonido 20W RMS - Optimización del sonido: Diálogo nítido, Dolby Atmos, Nivelador automático de volumen, Mejora de gravesDolby, Sonido IA - Aplicaciones preinstaladas: Amazon Prime Video, Disney+, YouTube, Netflix - Formatos de reproducción de video: AVI, MKV, H264/MPEG-4 AVC, MPEG-1, MPEG-2, MPEG-4, HEVC (H.265), VP9, AV1 - Formatos de subtítulos comptibles: .SMI, .SRT, .SUB, .TXT, .ASS, .SSA - Formatos de reproducción de música: AAC, MP3, WAV, WMA, WMA-PRO - Formatos de reproducción de imagen: JPEG, BMP, GIF, PNG, HEIF - Compatible con soporte de pared VESA 200x200mm - Medidas: 1226,8x711,8x86,6mm - Peso: 11,6kg - Medidas con soporte: 1226,8x743x248mm - Peso con soporte: 11,8kg - Accesorios incluídos: Control remoto, Cable de alimentación, Guía de inicio rápida, Folleto legal y de seguridad, Soporte para mesa- Modelo 55PUD7406/77"
2023-05-23T00:00:00Z,SMART TV ANDROID PHILIPS 65 PULGADAS 65OLED707/77,/Tecnología/TV Y VIDEO/TV LED Y SMART TV/,/Tecnología/TV Y VIDEO/,494270,https://www.hiperlibertad.com.ar/smart-tv-android-philips-65-pulgadas-65oled707-77/p,730449.0,730449.0,1.0,"La imagen realista que querés en nuestro televisor OLED más asequible. Juegos con capacidad de respuesta que te mantienen a la cabeza de la acción. Sonido emocionante para programas, películas y mucho más. Independientemente de lo que te guste, el envolvente Ambilight lo mejora. <p><span style=""text-decoration: underline;""><strong>Caracter&iacute;sticas:</strong></span></p><p>- Modelo: FR2520 GP HC A2<strong></strong></p><p>- Color: plata</p><p>- 4 fr&iacute;os<strong></strong></p><p>- Volumen:&nbsp; 224 lt</p><p>- Ancho:&nbsp; 945 mm</p><p>- Profundidad:&nbsp; 700 mm</p><p>- Alto: 840 mm</p><p>- Clasificaci&oacute;n energ&eacute;tica: Clase A</p>"
2023-05-23T00:00:00Z,SMART TV AOC 50 PULGADAS 4K 50U6295/77G,/Tecnología/TV Y VIDEO/TV LED Y SMART TV/,/Tecnología/TV Y VIDEO/,456341,https://www.hiperlibertad.com.ar/smart-tv-aoc-50-pulgadas-4k-50u6295-77g/p,129999.0,174269.0,2.0,"<p style=""text-align: center;""><br /><strong>SMART TV AOC 50 PULGADAS 4K 50U6295/77G</strong><br />Caracter&iacute;sticas generales<br />Marca AOC<br />Modelo 50U6295<br />Voltaje 220V<br /><br /><strong>Especificaciones</strong><br />Es smart S&iacute;<br />Conectividad<br />Con USB S&iacute;<br />Con HDMI S&iacute;<br />Cantidad de puertos HDMI 3<br />Cantidad de puertos USB 2<br />Con Wi-Fi S&iacute;<br /><br /><strong>Sonido</strong><br />Cantidad de parlantes 2<br />Potencia m&aacute;xima de los parlantes 16 W<br />Modos de sonido<br />Dolby Digital<br /><br /><strong>Pantalla</strong><br />Tipo de pantalla LED<br />Tama&ntilde;o de la pantalla 50 ""<br />Tipo de resoluci&oacute;n 4K<br />Con HDR S&iacute;<br />Resoluci&oacute;n m&aacute;xima 3840 px - 2160 px<br />Relaci&oacute;n de aspecto 16:9<br />Relaci&oacute;n de contraste 200000:1<br />Brillo 260 cd/m&sup2;<br /><br /><strong>Peso y dimensiones</strong><br />Ancho x Profundidad x Altura<br />1128 mm x 86 mm x 659 mm<br />Peso 11.4 kg<br /><br /><strong>Accesorios incluidos</strong><br />Control remoto, Cable de alimentaci&oacute;n<br />Tecnolog&iacute;a<br />Apps integradas<br />Netflix, YouTube</p>"
2023-05-23T00:00:00Z,"SMART TV HYUNDAI 58"" PULGADAS HYLED - 58UHD ANDROID",/Tecnología/TV Y VIDEO/TV LED Y SMART TV/,/Tecnología/TV Y VIDEO/,472080,https://www.hiperlibertad.com.ar/smart-tv-hyundai-58-pulgadas-4k-ultra-hd-hyled/p,168299.0,168299.0,2.0,"<p>&nbsp;</p> <p style=""text-align: center;""><strong>El Smart TV Hyundai 58"" posee pantalla de 58"" con resoluci&oacute;n 3840x2160 Ultra HD para que disfrutes tus pel&iacute;culas y series en la mejor calidad.</strong></p> <p style=""text-align: center;""><span>Cuenta con conectividad WiFi y puerto de red para que te conectes a tus servicios de streaming favoritos.</span></p> <p style=""text-align: center;""><span>Si te gusta una mejor calidad de audio, encontrar&aacute;s una salida para auriculares, y unos parlantes con potencia de sonido de 8W RMS (x2).</span></p> <p style=""text-align: center;""><span>Cuenta con distintos perfiles de sonido: Standard / Teatro /M&uacute;sica / Di&aacute;logo / Nocturno, para que puedas ecualizar el sonido a tu gusto.</span></p> <p style=""text-align: center;""><span>Y lo mejor es que dispones del Sistema Operativo Android TV, para que puedas descargar las apps que m&aacute;s te gusten!</span></p> <p style=""text-align: center;""><span>Mediante sus entradas HDMI pod&eacute;s vincular reproductores de audio y video; consolas de juegos y notebooks.</span></p> <p style=""text-align: center;""><span>Su gran capacidad de transmisi&oacute;n de datos permite disfrutar de im&aacute;genes en alta definici&oacute;n y un sonido de gran fidelidad. Tambi&eacute;n, a trav&eacute;s de sus puertos USB, podr&aacute;s reproducir contenido multimedia (m&uacute;sica, fotos y videos) almacenado en tus dispositivos externos como tablets, smartphones y pendrives.<br /><br /><strong>CARACTERISTICAS&nbsp;</strong></span></p> <p style=""text-align: center;""><span>Potencia De Parlantes (RMS):2&times;5W<br />Parlantes: Parlantes integrados (lado inferior)<br />Audio Y Video (A/V): MPEG2, MPEG4, WMV,FLV, H.264,HEVC<br />Frecuencia de actualizaci&oacute;n: 50/60Hz<br />Canales: 2~69(Aire),1~125((Cable)<br />Contraste Pantalla: 5000:1<br />Brillo de pantalla : 240(t&iacute;p.)<br />Alimentaci&oacute;n: AC 110V-240V 50/60Hz<br />Tiempo de respuesta:8ms<br />Im&aacute;genes: JPEG/PNG/BMP<br />Memoria : 2G DDR +16G EMMC<br />Musica:MP3/AC3/AAC<br />Tipo de pantalla: LED<br />Tamano de la pantalla: 58 pulgadas<br />Tipo de resolucion: 4K UHD<br />Es 3D: NO<br />Es curvo: NO<br />Tecnologia de pantalla: LED<br />Resolucion maxima: 3840 PX x 2160 PX<br />Relacion de aspecto: 0,672916666666667<br />Tiempo de respuesta: 8ms<br />Con HDMI: SI<br />Cantidad de puertos HDMI: 3<br />Con USB: SI<br />Cantidad de puertos USB: 1<br />Con Wi-Fi: SI<br />Con Bluetooth: SI<br />Cantidad de parlantes: 2x5W<br />Con youtube: SI<br />Con netflix: SI<br />Con navegador web: SI<br />Peso14.5 kg<br /><br /></span></p>"
2023-05-23T00:00:00Z,SMART TV PHILIPS 32 PULGADAS HD ANDROID 32PHD6927 BLANCO,/Tecnología/TV Y VIDEO/TV LED Y SMART TV/,/Tecnología/TV Y VIDEO/,492166,https://www.hiperlibertad.com.ar/smart-tv-philips-32-pulgadas-hd-android-32phd6927-blanco/p,85999.0,126749.0,2.0,"""Televisor Smart / Android. Pantalla: TV LED HD. Resolucion de panel: 1366 x 768 p. Relacion de aspecto: 16:9. Optimizacion de la imagen: HDR10, HLG (Hybrid Log Gamma), Pixel Plus alta definicion. Tamano diagonal de pantalla: 32 pulgadas / 80 cm. Cantidad de conexiones HDMI: 3. Cantidad de puertos USB: 2. WIFI. Bluetooth. Potencia de salida (RMS): 10 W. Configuracion del parlante: Altavoz de 5 W x2. Optimizacion del sonido: Nivelador automatico de volumen, Dialogo nitido, Dolby Atmos, Mejora de graves Dolby. Sistema operativo: Android TV 10 (Q). Aplicaciones preinstaladas: YouTube, Amazon, Prime Video, Apple TV, Disney+, Aplicacion de fitness, Google Play Movies, Google Play Music, Busqueda de Google, Netflix, YouTube Music. Tamano de la memoria (flash): 8 GB. Control por voz con IA: Presiona un boton del control remoto para hablar con el Asistente de Google. Controla el televisor o los dispositivos inteligentes para el hogar compatibles con el Asistente de Google usando tu voz. """
2023-05-23T00:00:00Z,"SMART TV PHILIPS 32"" PULGADAS  32PHD6917/77 ANDROID",/Tecnología/TV Y VIDEO/TV LED Y SMART TV/,/Tecnología/TV Y VIDEO/,492165,https://www.hiperlibertad.com.ar/smart-tv-philips-32-pulgadas-32phd6917-77-android/p,96655.2,120819.0,6.0,"<p style=""text-align: center;"">El Philips 32PHD6917/77 es un smart TV compacto y elegante con una pantalla LED de 32 pulgadas y resoluci&oacute;n HD (1366 x 768 p). Su motor de procesamiento optimiza la calidad de imagen para ofrecer nitidez, colores ricos y movimientos suaves. Desde videos de YouTube hasta series imperdibles de Netflix, siempre disfrutar&aacute;s de la mejor experiencia visual posible.<br /><br /><strong>Android TV</strong><br />Esta Android TV de Philips te ofrece el contenido que quer&eacute;s cuando lo quer&eacute;s. Podr&aacute;s personalizar la pantalla de inicio para mostrar tus aplicaciones favoritas, lo que te facilitar&aacute; la reproducci&oacute;n de las pel&iacute;culas y los programas que te encantan.<br /><br /><strong>Caracter&iacute;sticas T&eacute;cnicas</strong><br /><strong>Imagen</strong><br />Resoluci&oacute;n 1366 x 768 p<br />Formato de pantalla Plano<br />3D No<br /><br /><strong>Caracter&iacute;sticas Generales</strong><br />Smart TV S&iacute;<br />Color Bisel negro mate<br /><br /><strong>Caracteristicas Smart</strong><br />Youtube S&iacute;<br />Netflix S&iacute;<br />Control por Voz S&iacute;<br />Conectividad<br />Entradas HDMI 3<br />Entradas USB 2<br />Conexi&oacute;n a Internet S&iacute;<br />NFC No<br />Salidas audio &oacute;ptico digital S&iacute;<br />Conector para auriculares S&iacute;<br />HDMI ARC S&iacute;<br /><br /><strong>Sonido</strong><br />Cantidad de parlantes 2<br />Potencia 10W RMS<br /><br /><strong>Que Incluye?</strong><br />Control Remoto S&iacute;<br />Otros Accesorios Incluidos<br />2 pilas AAA, Cable de alimentaci&oacute;n, Gu&iacute;a de inicio r&aacute;pida, Folleto legal y de seguridad, Soporte para la mesa<br /><br /><strong>Dimensiones</strong><br />Alto 433 mm<br />Ancho 716 mm<br />Profundidad 76 mm<br />Alto (con base) 453 mm<br />Ancho (con base) 716 mm<br />Profundidad (con base) 166 mm<br />Medida VESA 100 x 100 mm<br />Peso 3,98 kg</p>"
2023-05-23T00:00:00Z,SMART TV PHILIPS 65 PULGADAS 4K UHD 65PUD7906/77,/Tecnología/TV Y VIDEO/TV LED Y SMART TV/,/Tecnología/TV Y VIDEO/,482039,https://www.hiperlibertad.com.ar/smart-tv-philips-65-pulgadas-4k-uhd-65pud7906-77/p,296999.1,414979.0,5.0,"<p style=""text-align: center;""><br /><strong>SMART TV PHILIPS 65 PULGADAS 4K UHD 65PUD7906/77<br /></strong><br />Televisor 4K UHD<br />Con tecnolog&iacute;a Ambilight en 3 lados <br />Control por voz con el Asistente de Google <br />HDR para im&aacute;genes brillantes<br />Dise&ntilde;o atractivo y ultra fino, con marco plateado<br />Dolby Vision y Dolby Atmos para visi&oacute;n y sonido cinematogr&aacute;fico <br />Se puede personalizar la pantalla de inicio para mostrar las apps preferidas, facilitando la reproducci&oacute;n de las pel&iacute;culas y los programas favoritos<br />Ideal para jugar con cualquier consola gracias a su bajo tiempo de latencia.<br /><br />Tama&ntilde;o diagonal de pantalla: 65 pulgadas / 164 cm<br />Pantalla: LED 4K Ultra HD<br />Resoluci&oacute;n de panel: 3840 x 2160<br />Relaci&oacute;n de aspecto: 16:9 <br />Optimizaci&oacute;n de la imagen: Resoluci&oacute;n Ultra, Dolby Vision, HLG (Hybrid Log Gamma), Compatible con HDR10+<br />Motor Pixel: Pixel Precise Ultra HD<br />Cantidad de conexiones HDMI: 4<br />Cantidad de puertos USB: 2<br /><br />Dimensiones de la caja:<br />Ancho 1600 mm<br />Alto 995 mm<br />Profundidad 170 mm<br /><br />Dimensiones del aparato con soporte incluido:<br />Ancho 1450,5 mm <br />Alto 860,5 mm <br />Profundidad 293,2 mm<br />Peso del producto: 21,3 kg <br />Peso del producto (+ soporte): 21,5 kg <br />Compatible con el soporte de pared VESA: 300 x 300 mm - Peso con embalaje incluido: 28,4 kg</p>"
2023-05-23T00:00:00Z,SMART TV SAMSUNG 65 PULGADAS 4K UHD NEO QLED 65QN85B,/Tecnología/TV Y VIDEO/TV LED Y SMART TV/,/Tecnología/TV Y VIDEO/,495433,https://www.hiperlibertad.com.ar/smart-tv-samsung-65-pulgadas-4k-uhd-neo-qled-65qn85b/p,766999.0,766999.0,1.0,"La imagen realista que querés en nuestro televisor OLED más asequible. Juegos con capacidad de respuesta que te mantienen a la cabeza de la acción. Sonido emocionante para programas, películas y mucho más. Independientemente de lo que te guste, el envolvente Ambilight lo mejora."
