Fecha_de_publicacion,Nombre_del_producto,Categoria,Subcategoria,Codigo_del_producto,URL,Precio_publicado,Precio_regular,Stock,Descripcion
2023-05-29T00:00:00Z,Insecticida Jeringas Cucarachicidas Raid 3 Gr,/Limpieza/Insecticidas/Cebos y Pastillas/,/Limpieza/Insecticidas/,170616,https://www.hiperlibertad.com.ar/insecticida-jeringas-cucarachicidas-raid-3-gr/p,621.99,621.99,22.0,"Insecticida Jeringas Cucarachicidas Raid 3 Gr   ""* La jeringa de Raid Max es mas práctica ya que por su formato, permite aplicar pequeñas gotas de gel activo en más lugares aumentando los puntos de contacto entre las cucarachas y el activo insecticida. INSTRUCCIONES DE USO: 1.Retire la tapa de la jeringa.2.Presione suavemente el émbolo y aplique pequeños puntos de gel (2mm. De diámetro por m2 o metro lineal) en aquellos lugres donde suele ver a las cucarachas: en la cocina, el baño, el lavadero, y cualquier otro ambiente donde sospeche que estén o por donde piense que ellas pueden pasar.3.Aplicar el gel junto a los zócalos, en estanterías, cajones, alacenas, debajo de heladeras, cañerías y otros lugares por donde las cucarachas suelen pasar.4.Revisar periódicamente los puntos de aplicación y volver a aplicar en caso que el gel haya sido consumido por las cucarachas.5.Evite colocar el gel en lugares accesibles para niños y mascotas.6.Repita la aplicación cada tres meses para lograr un control total del problema y para que las cucarachas no regresen. Anote en su almanaque o en algún lugar visible la fecha en que debe volver a aplicar."""
2023-05-29T00:00:00Z,OFF CREMA EXT DUR X100G,/Limpieza/Insecticidas/Repelentes/,/Limpieza/Insecticidas/,492933,https://www.hiperlibertad.com.ar/off-crema-ext-dur-x100g/p,628.0,628.0,21.0,OFF CREMA EXT DUR X100G
2023-05-23T00:00:00Z,RAID AP. S/CABLE +4TAB/12 AR,/Limpieza/Insecticidas/Tabletas y Difusores/,/Limpieza/Insecticidas/,469660,https://www.hiperlibertad.com.ar/raid-ap-s-cable-4tab-12-ar/p,846.99,846.99,43.0,RAID AP. S/CABLE +4TAB/12 AR
2023-05-23T00:00:00Z,RAID MATS 24UN/80 AR,/Limpieza/Insecticidas/Tabletas y Difusores/,/Limpieza/Insecticidas/,468222,https://www.hiperlibertad.com.ar/raid-mats-24un-80-ar/p,359.0,359.0,305.0,RAID MATS 24UN/80 AR
2023-05-23T00:00:00Z,RAID TABLETAS 12UN/20 AR,/Limpieza/Insecticidas/Tabletas y Difusores/,/Limpieza/Insecticidas/,466943,https://www.hiperlibertad.com.ar/raid-tabletas-12un-20-ar/p,289.0,289.0,54.0,RAID TABLETAS 12UN/20 AR
2023-05-23T00:00:00Z,REPELENTE DE INSECTOS OFF SPRAY EXTRA DURACION X 177 Ml,/Limpieza/Insecticidas/Repelentes/,/Limpieza/Insecticidas/,493451,https://www.hiperlibertad.com.ar/repelente-de-insectos-off-spray-extra-duracion-x-177-ml/p,1073.99,1073.99,23.0,REPELENTE DE INSECTOS OFF SPRAY EXTRA DURACION X 177 Ml
2023-05-29T00:00:00Z,Raid Insecticida Mata Cucarachas Cebo Exterminador 6 Und,/Limpieza/Insecticidas/Cebos y Pastillas/,/Limpieza/Insecticidas/,365691,https://www.hiperlibertad.com.ar/raid-insecticida-mata-cucarachas-cebo-exterminador-6-und/p,651.99,651.99,47.0,Raid Insecticida Mata Cucarachas Cebo Exterminador 6 Und
2023-05-23T00:00:00Z,Repelente Para Mosquitos Off Aerosol Extra Duración x 170 ml,/Limpieza/Insecticidas/Repelentes/,/Limpieza/Insecticidas/,492936,https://www.hiperlibertad.com.ar/repelente-para-mosquitos-off-aerosol-extra-duraci-n-x-170-ml/p,793.0,793.0,2.0,Repelente Para Mosquitos Off Aerosol Extra Duración x 170 ml
2023-05-23T00:00:00Z,LAVANDINA AYUDIN ANTISPLASH 2L,/Limpieza/Lavandina/Lavandina en Gel/,/Limpieza/Lavandina/,469029,https://www.hiperlibertad.com.ar/lavandina-ayudin-antisplash-2l/p,441.99,441.99,232.0,LAVANDINA AYUDIN ANTISPLASH 2L
2023-05-23T00:00:00Z,LAVANDINA AYUDIN ANTSPLASH 1 LT,/Limpieza/Lavandina/Lavandina en Gel/,/Limpieza/Lavandina/,469028,https://www.hiperlibertad.com.ar/lavandina-ayudin-antsplash-1-lt/p,239.0,239.0,271.0,LAVANDINA AYUDIN ANTSPLASH 1 LT
2023-05-23T00:00:00Z,LAVANDINA AYUDIN CLASICA 2L,/Limpieza/Lavandina/Lavandina en Gel/,/Limpieza/Lavandina/,472415,https://www.hiperlibertad.com.ar/lavandina-ayudin-clasica-2l/p,372.99,372.99,141.0,LAVANDINA AYUDIN CLASICA 2L
2023-05-23T00:00:00Z,LAVANDINA AYUDIN TRIPLE PODER LAVANDA X2,/Limpieza/Lavandina/Lavandina en Gel/,/Limpieza/Lavandina/,470670,https://www.hiperlibertad.com.ar/lavandina-ayudin-triple-poder-lavanda-x2/p,397.0,397.0,362.0,LAVANDINA AYUDIN TRIPLE PODER LAVANDA X2
2023-05-23T00:00:00Z,LAVANDINA AYUDIN TRIPLE PODER LAVANDA X4,/Limpieza/Lavandina/Lavandina en Gel/,/Limpieza/Lavandina/,470671,https://www.hiperlibertad.com.ar/lavandina-ayudin-triple-poder-lavanda-x4/p,789.99,789.99,74.0,LAVANDINA AYUDIN TRIPLE PODER LAVANDA X4
2023-05-23T00:00:00Z,LAVANDINA AYUDIN TRIPLE PODER P.GL X 4LT,/Limpieza/Lavandina/Lavandina en Gel/,/Limpieza/Lavandina/,470651,https://www.hiperlibertad.com.ar/lavandina-ayudin-triple-poder-p-gl-x-4lt/p,789.99,789.99,107.0,LAVANDINA AYUDIN TRIPLE PODER P.GL X 4LT
2023-05-23T00:00:00Z,LAVANDINA AYUDIN TRIPLE PODER P.GL X1,/Limpieza/Lavandina/Lavandina en Gel/,/Limpieza/Lavandina/,470649,https://www.hiperlibertad.com.ar/lavandina-ayudin-triple-poder-p-gl-x1/p,210.99,210.99,219.0,LAVANDINA AYUDIN TRIPLE PODER P.GL X1
2023-05-23T00:00:00Z,LAVANDINA AYUDÍN CLÁSICA 1L,/Limpieza/Lavandina/Lavandina en Gel/,/Limpieza/Lavandina/,472413,https://www.hiperlibertad.com.ar/lavandina-ayudin-clasica-1l/p,198.99,198.99,706.0,LAVANDINA AYUDÍN CLÁSICA 1L
2023-05-23T00:00:00Z,ADHESIVO GLADE LAVANDA ONESTRIP X 8.2GR,/Limpieza/Limpieza de Baño/Pastillas y Bloques/,/Limpieza/Limpieza de Baño/,464510,https://www.hiperlibertad.com.ar/adhesivo-glade-lavanda-onestrip-x-8-2gr/p,101.99,101.99,57.0,ADHESIVO GLADE LAVANDA ONESTRIP X 8.2GR
2023-05-29T00:00:00Z,Bloque adhesivo PATO PURIFIC CITRUS,/Limpieza/Limpieza de Baño/Pastillas y Bloques/,/Limpieza/Limpieza de Baño/,332004,https://www.hiperlibertad.com.ar/bloque-adhesivo-pato-purific-citrus/p,214.99,214.99,392.0,Bloque adhesivo PATO PURIFIC CITRUS
2023-05-23T00:00:00Z,"CANASTA SOLIDA PATO PINO X 38,6 Gr",/Limpieza/Limpieza de Baño/Pastillas y Bloques/,/Limpieza/Limpieza de Baño/,485993,https://www.hiperlibertad.com.ar/canasta-solida-pato-pino-x-38-6-gr/p,483.99,483.99,11.0,"CANASTA SOLIDA PATO PINO X 38,6 Gr"
2023-05-29T00:00:00Z,Canasta Inodoro Glade 27.5 Gr,/Limpieza/Limpieza de Baño/Pastillas y Bloques/,/Limpieza/Limpieza de Baño/,371492,https://www.hiperlibertad.com.ar/canasta-inodoro-glade-27-5-gr/p,257.99,257.99,14.0,Canasta Inodoro Glade 27.5 Gr
2023-05-29T00:00:00Z,"Canasta Inodoro Glade Repuesto Brisa De Mar 27,5 g",/Limpieza/Limpieza de Baño/Pastillas y Bloques/,/Limpieza/Limpieza de Baño/,371496,https://www.hiperlibertad.com.ar/canasta-inodoro-glade-repuesto-brisa-de-mar-27-5-g/p,146.52,146.52,275.0,"Canasta Inodoro Glade Repuesto Brisa De Mar 27,5 g"
2023-05-29T00:00:00Z,Canasta Liquida Glade Brisa De Las Cumbres 50 ml,/Limpieza/Limpieza de Baño/Pastillas y Bloques/,/Limpieza/Limpieza de Baño/,354821,https://www.hiperlibertad.com.ar/canasta-liquida-glade-brisa-de-las-cumbres-50-ml/p,548.99,548.99,45.0,Canasta Liquida Glade Brisa De Las Cumbres 50 ml
2023-05-29T00:00:00Z,Canasta Liquida Glade Inodoro Repuesto Lavanda 50 ml,/Limpieza/Limpieza de Baño/Pastillas y Bloques/,/Limpieza/Limpieza de Baño/,354820,https://www.hiperlibertad.com.ar/canasta-liquida-glade-inodoro-repuesto-lavanda-50-ml/p,548.99,548.99,3.0,Canasta Liquida Glade Inodoro Repuesto Lavanda 50 ml
2023-05-29T00:00:00Z,Canasta Liquida Mr Musculo Pino 50 ml,/Limpieza/Limpieza de Baño/Pastillas y Bloques/,/Limpieza/Limpieza de Baño/,356191,https://www.hiperlibertad.com.ar/canasta-liquida-mr-musculo-pino-50-ml/p,480.99,480.99,44.0,Canasta Liquida Mr Musculo Pino 50 ml
2023-05-23T00:00:00Z,Canasta Lysoform Fresh Solida Pino 38.6 Gr,/Limpieza/Limpieza de Baño/Pastillas y Bloques/,/Limpieza/Limpieza de Baño/,435702,https://www.hiperlibertad.com.ar/canasta-lysoform-fresh-solida-pino-38-6-gr/p,437.99,437.99,126.0,Canasta Lysoform Fresh Solida Pino 38.6 Gr
2023-05-29T00:00:00Z,Canasta Para Inodoros Glade Aparato Completo 50 mL,/Limpieza/Limpieza de Baño/Pastillas y Bloques/,/Limpieza/Limpieza de Baño/,354818,https://www.hiperlibertad.com.ar/canasta-para-inodoros-glade-aparato-completo-50-ml/p,594.99,594.99,8.0,Canasta Para Inodoros Glade Aparato Completo 50 mL
2023-05-29T00:00:00Z,Canasta Para Inodoros Glade Aparato Completo 50 mL I Love You,/Limpieza/Limpieza de Baño/Pastillas y Bloques/,/Limpieza/Limpieza de Baño/,354819,https://www.hiperlibertad.com.ar/canasta-para-inodoros-glade-aparato-completo-50-ml-i-love-you/p,630.0,630.0,32.0,Canasta Para Inodoros Glade Aparato Completo 50 mL I Love You
2023-05-29T00:00:00Z,Canasta Para Inodoros Glade Lavanda 50 ml,/Limpieza/Limpieza de Baño/Pastillas y Bloques/,/Limpieza/Limpieza de Baño/,354817,https://www.hiperlibertad.com.ar/desod-glade-can-liq-f-lavx50cc/p,630.0,630.0,32.0,DESOD.GLADE CAN.LIQ.F.LAVX50CC
2023-05-23T00:00:00Z,Canasta Solida Lysoform Citrico 38 g,/Limpieza/Limpieza de Baño/Pastillas y Bloques/,/Limpieza/Limpieza de Baño/,435701,https://www.hiperlibertad.com.ar/canasta-solida-lysoform-citrico-38-g/p,437.99,437.99,1.0,Canasta Solida Lysoform Citrico 38 g
2023-05-23T00:00:00Z,DESTAPA CANERIAS AYUDIN X 1 LT,/Limpieza/Limpieza de Baño/Destapa Cañerías/,/Limpieza/Limpieza de Baño/,46005,https://www.hiperlibertad.com.ar/destapa-canerias-ayudin-x-1-lt/p,657.99,657.99,29.0,"El Destapacañerías Ayudín elimina toda la materia orgánica de las cañerías, desagüe y cloacas; dejándolos limpios. No daña las cañerías. Rápida solución al problema de cañerías tapadas o lento desagüe. Actúa a través del agua estancada en la pileta."
2023-05-29T00:00:00Z,DISCO ADHESIVO PATO FLORAL X 36ML,/Limpieza/Limpieza de Baño/Pastillas y Bloques/,/Limpieza/Limpieza de Baño/,374530,https://www.hiperlibertad.com.ar/disco-adhesivo-pato-floral-x-36ml/p,543.99,543.99,19.0,DISCO ADHESIVO PATO FLORAL X 36ML
2023-05-29T00:00:00Z,DISCO ADHESIVO PATO MARINA AP X36ML,/Limpieza/Limpieza de Baño/Pastillas y Bloques/,/Limpieza/Limpieza de Baño/,374528,https://www.hiperlibertad.com.ar/disco-adhesivo-pato-marina-ap-x36ml/p,815.0,815.0,28.0,DISCO ADHESIVO PATO MARINA AP X36ML
2023-05-29T00:00:00Z,Discos adhesivos Pato Marina Repuesto 36ml,/Limpieza/Limpieza de Baño/Pastillas y Bloques/,/Limpieza/Limpieza de Baño/,353612,https://www.hiperlibertad.com.ar/discos-adhesivos-pato-marina-repuesto-36ml/p,543.99,543.99,184.0,Discos adhesivos Pato Marina Repuesto 36ml
2023-05-23T00:00:00Z,Gel Adhesivo Glade Lavanda Discos,/Limpieza/Limpieza de Baño/Pastillas y Bloques/,/Limpieza/Limpieza de Baño/,442058,https://www.hiperlibertad.com.ar/gel-adhesivo-glade-lavanda-discos/p,429.99,429.99,12.0,Gel Adhesivo Glade Lavanda Discos
2023-05-29T00:00:00Z,Gel Adhesivo Glade Limón Refrescante Repuesto 36 ml,/Limpieza/Limpieza de Baño/Pastillas y Bloques/,/Limpieza/Limpieza de Baño/,354800,https://www.hiperlibertad.com.ar/gel-adhesivo-glade-lim-n-refrescante-repuesto-36-ml/p,543.99,543.99,18.0,Gel Adhesivo Glade Limón Refrescante Repuesto 36 ml
2023-05-29T00:00:00Z,Gel para Inodoro Lysoform Citrica 30 g,/Limpieza/Limpieza de Baño/Pastillas y Bloques/,/Limpieza/Limpieza de Baño/,411404,https://www.hiperlibertad.com.ar/gel-para-inodoro-lysoform-citrica-30-g/p,239.0,239.0,115.0,Gel para Inodoro Lysoform Citrica 30 g
2023-05-29T00:00:00Z,LIMPIADOR DE BAÑOS ECOVITA LIQUIDO X 500 Ml,/Limpieza/Limpieza de Baño/Desinfectantes/,/Limpieza/Limpieza de Baño/,356641,https://www.hiperlibertad.com.ar/limpiador-de-ba-os-ecovita-liquido-x-500-ml/p,190.99,190.99,91.0,LIMPIADOR DE BAÑOS ECOVITA LIQUIDO X 500 Ml
2023-05-23T00:00:00Z,LIMPIADOR LIQUIDO AYUDIN BAÑO LIMPIEZA ACTIVA X 450 Ml,/Limpieza/Limpieza de Baño/Desinfectantes/,/Limpieza/Limpieza de Baño/,482734,https://www.hiperlibertad.com.ar/limpiador-liquido-ayudin-ba-o-limpieza-activa-x-450-ml/p,213.99,213.99,63.0,LIMPIADOR LIQUIDO AYUDIN BAÑO LIMPIEZA ACTIVA X 450 Ml
2023-05-23T00:00:00Z,LIMPIADOR LIQUIDO ZORRO ULTRA BAÑO GATILLO X 500 Ml,/Limpieza/Limpieza de Baño/Desinfectantes/,/Limpieza/Limpieza de Baño/,482385,https://www.hiperlibertad.com.ar/limpiador-liquido-zorro-ultra-ba-o-gatillo-x-500-ml/p,370.34,370.34,107.0,LIMPIADOR LIQUIDO ZORRO ULTRA BAÑO GATILLO X 500 Ml
2023-05-29T00:00:00Z,LIMPiador PROCENEX BAÑO 420 ML,/Limpieza/Limpieza de Baño/Desinfectantes/,/Limpieza/Limpieza de Baño/,391153,https://www.hiperlibertad.com.ar/limpiador-procenex-bano-420-ml/p,239.0,239.0,25.0,LIMPiador PROCENEX BAÑO 420 ML
2023-05-29T00:00:00Z,ABRILLANTADOR FINISH X 400 Ml,/Limpieza/Limpieza de Cocina/Detergentes/,/Limpieza/Limpieza de Cocina/,386804,https://www.hiperlibertad.com.ar/abrillantador-finish-x-400-ml/p,2191.99,2191.99,71.0,ABRILLANTADOR FINISH X 400 Ml
2023-05-23T00:00:00Z,ALCOHOL QUEMAR PORTA x 1000CC,/Limpieza/Limpieza de Cocina/Limpiadores/,/Limpieza/Limpieza de Cocina/,65001,https://www.hiperlibertad.com.ar/alcohol-quemar-porta-x-1000cc/p,535.99,535.99,13.0,ALCOHOL QUEMAR PORTA x 1000CC
2023-05-29T00:00:00Z,ALUMINIO SEPARATA ESTUCHE 28C X 25M,/Limpieza/Limpieza de Cocina/Bolsas y Film/,/Limpieza/Limpieza de Cocina/,205819,https://www.hiperlibertad.com.ar/aluminio-separata-estuche-28c-x-25m/p,1252.99,1252.99,4.0,ALUMINIO SEPARATA ESTUCHE 28C X 25M
2023-05-23T00:00:00Z,BOLSA BOZIP CIERRE FACIL GRANDE X 4 U,/Limpieza/Limpieza de Cocina/Bolsas y Film/,/Limpieza/Limpieza de Cocina/,475854,https://www.hiperlibertad.com.ar/bolsa-bozip-cierre-facil-grande-x-4-u/p,608.76,608.76,170.0,BOLSA BOZIP CIERRE FACIL GRANDE X 4 U
2023-05-23T00:00:00Z,BOLSA HERMETICA BOLZIP GRANDE DOBLE CIERRE X 5 U,/Limpieza/Limpieza de Cocina/Bolsas y Film/,/Limpieza/Limpieza de Cocina/,462528,https://www.hiperlibertad.com.ar/bolsa-hermetica-bolzip-grande-doble-cierre-x-5-u/p,608.76,608.76,94.0,BOLSA HERMETICA BOLZIP GRANDE DOBLE CIERRE X 5 U
2023-05-23T00:00:00Z,BOLSAS HERMETICAS BOLZIP MEDIANAS DOBLE CIERRE X 8 U,/Limpieza/Limpieza de Cocina/Bolsas y Film/,/Limpieza/Limpieza de Cocina/,431867,https://www.hiperlibertad.com.ar/bolsas-hermeticas-bolzip-medianas-doble-cierre-x-8-u/p,608.76,608.76,90.0,BOLSAS HERMETICAS BOLZIP MEDIANAS DOBLE CIERRE X 8 U
2023-05-29T00:00:00Z,BOLSAS SEPARATA CON CIERRE A PRESION X 5 U,/Limpieza/Limpieza de Cocina/Bolsas y Film/,/Limpieza/Limpieza de Cocina/,145911,https://www.hiperlibertad.com.ar/bolsas-separata-con-cierre-a-presion-x-5-u/p,329.99,329.99,13.0,BOLSAS SEPARATA CON CIERRE A PRESION X 5 U
2023-05-23T00:00:00Z,BOLSAS ZIPLOC CHICA X 14 U,/Limpieza/Limpieza de Cocina/Bolsas y Film/,/Limpieza/Limpieza de Cocina/,437731,https://www.hiperlibertad.com.ar/bolsas-ziploc-chica-x-14-u/p,399.0,399.0,22.0,BOLSAS ZIPLOC CHICA X 14 U
2023-05-23T00:00:00Z,BOLSAS ZIPLOC GRANDES X 19 U,/Limpieza/Limpieza de Cocina/Bolsas y Film/,/Limpieza/Limpieza de Cocina/,437735,https://www.hiperlibertad.com.ar/bolsas-ziploc-grandes-x-19-u/p,685.0,685.0,10.0,BOLSAS ZIPLOC GRANDES X 19 U
2023-05-23T00:00:00Z,BOLSAS ZIPLOC MEDIANA X24UN,/Limpieza/Limpieza de Cocina/Bolsas y Film/,/Limpieza/Limpieza de Cocina/,437736,https://www.hiperlibertad.com.ar/bolsas-ziploc-mediana-x24un/p,648.0,648.0,9.0,BOLSAS ZIPLOC MEDIANA X24UN
2023-05-23T00:00:00Z,BOLSAS ZIPLOC MEDIANAS X 20 U,/Limpieza/Limpieza de Cocina/Bolsas y Film/,/Limpieza/Limpieza de Cocina/,437738,https://www.hiperlibertad.com.ar/bolsas-ziploc-medianas-x-20-u/p,833.99,833.99,10.0,BOLSAS ZIPLOC MEDIANAS X 20 U
2023-05-29T00:00:00Z,BOLSAS ZIPLOC MULTIPACK X 9 U,/Limpieza/Limpieza de Cocina/Bolsas y Film/,/Limpieza/Limpieza de Cocina/,129167,https://www.hiperlibertad.com.ar/bolsas-ziploc-multipack-x-9-u/p,451.99,451.99,19.0,BOLSAS ZIPLOC MULTIPACK X 9 U
2023-05-23T00:00:00Z,Bolsa Ziploc Hermetica Extra Chica 50 Und,/Limpieza/Limpieza de Cocina/Bolsas y Film/,/Limpieza/Limpieza de Cocina/,437732,https://www.hiperlibertad.com.ar/bolsa-ziploc-hermetica-extra-chica-50-und/p,756.0,756.0,98.0,Bolsa Ziploc Hermetica Extra Chica 50 Und
2023-05-23T00:00:00Z,Bolsas Ziploc medianas 12 unid.,/Limpieza/Limpieza de Cocina/Bolsas y Film/,/Limpieza/Limpieza de Cocina/,437734,https://www.hiperlibertad.com.ar/bolsas-ziploc-medianas-12-unid/p,426.99,426.99,59.0,Bolsas Ziploc medianas 12 unid.
2023-05-23T00:00:00Z,DET CIF BIO LIMA X300ML,/Limpieza/Limpieza de Cocina/Detergentes/,/Limpieza/Limpieza de Cocina/,504811,https://www.hiperlibertad.com.ar/detergente-cif-bioactive-lima-x-300-ml/p,353.0,353.0,6.0,DET CIF BIO LIMA X300ML
2023-05-23T00:00:00Z,DET CIF BIO LIMON X500ML,/Limpieza/Limpieza de Cocina/Detergentes/,/Limpieza/Limpieza de Cocina/,504757,https://www.hiperlibertad.com.ar/detergente-cif-bioactive-limon-x-500-ml/p,559.99,559.99,5.0,DET CIF BIO LIMON X500ML
2023-05-18T00:00:00Z,DETERGENTE CIF BIO LIM�N BOTELLA X 500 ML.,/Limpieza/Limpieza de Cocina/Detergentes/,/Limpieza/Limpieza de Cocina/,485878,https://www.hiperlibertad.com.ar/detergente-cif-bioactive-lim-n-500-ml-botella/p,488.0,488.0,1703.0,DETERGENTE CIF BIO LIM�N BOTELLA X 500 ML.
2023-05-29T00:00:00Z,DETERGENTE EN TABLETAS FINISH PARA LAVAVAJILLAS X 13 U,/Limpieza/Limpieza de Cocina/Jabón Lavavajillas/,/Limpieza/Limpieza de Cocina/,408366,https://www.hiperlibertad.com.ar/detergente-en-tabletas-finish-para-lavavajillas-x-13-u/p,1147.49,1730.99,26.0,DETERGENTE EN TABLETAS FINISH PARA LAVAVAJILLAS X 13 U
2023-05-23T00:00:00Z,DETERGENTE FINISH EN POLVO 1KG,/Limpieza/Limpieza de Cocina/Jabón Lavavajillas/,/Limpieza/Limpieza de Cocina/,458080,https://www.hiperlibertad.com.ar/detergente-finish-en-polvo-1kg/p,907.2,1513.99,66.0,DETERGENTE FINISH EN POLVO 1KG
2023-05-23T00:00:00Z,DETERGENTE FINISH TABLETAS 30,/Limpieza/Limpieza de Cocina/Jabón Lavavajillas/,/Limpieza/Limpieza de Cocina/,467469,https://www.hiperlibertad.com.ar/detergente-finish-tabletas-30/p,2068.2,3119.0,66.0,DETERGENTE FINISH TABLETAS 30
2023-05-23T00:00:00Z,DETERGENTE LAVAVAJILLAS MAGISTRAL ULTRA LIMON X 500 Ml,/Limpieza/Limpieza de Cocina/Detergentes/,/Limpieza/Limpieza de Cocina/,495667,https://www.hiperlibertad.com.ar/detergente-lavavajillas-magistral-ultra-limon-x-500-ml/p,685.99,685.99,159.0,DETERGENTE LAVAVAJILLAS MAGISTRAL ULTRA LIMON X 500 Ml
2023-05-23T00:00:00Z,DETERGENTE LAVAVAJILLAS MAGISTRAL ULTRA MARINA X 500 Ml,/Limpieza/Limpieza de Cocina/Detergentes/,/Limpieza/Limpieza de Cocina/,495668,https://www.hiperlibertad.com.ar/detergente-lavavajillas-magistral-ultra-marina-x-500-ml/p,648.99,648.99,52.0,DETERGENTE LAVAVAJILLAS MAGISTRAL ULTRA MARINA X 500 Ml
2023-03-08T00:00:00Z,Detergente  CIF  Bioactive Frutas Cítricas 300 ml Botella,/Limpieza/Limpieza de Cocina/Detergentes/,/Limpieza/Limpieza de Cocina/,485791,https://www.hiperlibertad.com.ar/detergente-cif-bioactive-frutas-c-tricas-300-ml-botella/p,153.99,307.99,2.0,Detergente  CIF  Bioactive Frutas Cítricas 300 ml Botella
2023-03-08T00:00:00Z,Detergente  CIF  Bioactive Lima 300 ml Botella,/Limpieza/Limpieza de Cocina/Detergentes/,/Limpieza/Limpieza de Cocina/,485793,https://www.hiperlibertad.com.ar/detergente-cif-bioactive-lima-300-ml-botella/p,307.99,307.99,3982.0,Detergente  CIF  Bioactive Lima 300 ml Botella
2023-05-23T00:00:00Z,ACONDICIONADOR PARA PISOS ECHO FLORAL 800 M,/Limpieza/Limpieza de Pisos y Muebles/Ceras y Autobrillos/,/Limpieza/Limpieza de Pisos y Muebles/,469644,https://www.hiperlibertad.com.ar/acondicionador-para-pisos-echo-floral-800-m/p,448.99,448.99,4.0,ACONDICIONADOR PARA PISOS ECHO FLORAL 800 M
2023-05-23T00:00:00Z,BLEM CERA RENV UNIV. LISTO 1L,/Limpieza/Limpieza de Pisos y Muebles/Ceras y Autobrillos/,/Limpieza/Limpieza de Pisos y Muebles/,463383,https://www.hiperlibertad.com.ar/cera-blem-renv-univ-listo-1l/p,890.0,890.0,20.0,BLEM CERA RENV UNIV. LISTO 1L
2023-05-23T00:00:00Z,BLEM EMB. CEMENTO INC. BT800,/Limpieza/Limpieza de Pisos y Muebles/Ceras y Autobrillos/,/Limpieza/Limpieza de Pisos y Muebles/,469635,https://www.hiperlibertad.com.ar/blem-emb-cemento-inc-bt800/p,835.99,835.99,34.0,BLEM EMB. CEMENTO INC. BT800
2023-05-23T00:00:00Z,BLEM EMB. CER�MICOS ACR� BT80,/Limpieza/Limpieza de Pisos y Muebles/Ceras y Autobrillos/,/Limpieza/Limpieza de Pisos y Muebles/,469631,https://www.hiperlibertad.com.ar/blem-emb-cer-micos-acr-bt80/p,1056.99,1056.99,17.0,BLEM EMB. CER�MICOS ACR� BT80
2023-05-23T00:00:00Z,BLEM EMB. CER�MICOS FLO. DP45,/Limpieza/Limpieza de Pisos y Muebles/Ceras y Autobrillos/,/Limpieza/Limpieza de Pisos y Muebles/,469646,https://www.hiperlibertad.com.ar/blem-emb-cer-micos-flo-dp45/p,519.0,519.0,3.0,BLEM EMB. CER�MICOS FLO. DP45
2023-05-23T00:00:00Z,BLEM EMB. CER�MICOS INC. BT80,/Limpieza/Limpieza de Pisos y Muebles/Ceras y Autobrillos/,/Limpieza/Limpieza de Pisos y Muebles/,469630,https://www.hiperlibertad.com.ar/blem-emb-cer-micos-inc-bt80/p,835.99,835.99,55.0,BLEM EMB. CER�MICOS INC. BT80
2023-05-23T00:00:00Z,BLEM EMB. CER�MICOS ROJO DP45,/Limpieza/Limpieza de Pisos y Muebles/Ceras y Autobrillos/,/Limpieza/Limpieza de Pisos y Muebles/,469647,https://www.hiperlibertad.com.ar/blem-emb-cer-micos-rojo-dp45/p,519.0,519.0,5.0,BLEM EMB. CER�MICOS ROJO DP45
2023-05-23T00:00:00Z,BLEM EMB. PORCELAN. INC. BT80,/Limpieza/Limpieza de Pisos y Muebles/Ceras y Autobrillos/,/Limpieza/Limpieza de Pisos y Muebles/,469634,https://www.hiperlibertad.com.ar/blem-emb-porcelan-inc-bt80/p,835.99,835.99,36.0,BLEM EMB. PORCELAN. INC. BT80
2023-05-23T00:00:00Z,BLEM EMB. PORCELAN. INC. DP45,/Limpieza/Limpieza de Pisos y Muebles/Ceras y Autobrillos/,/Limpieza/Limpieza de Pisos y Muebles/,469648,https://www.hiperlibertad.com.ar/blem-emb-porcelan-inc-dp45/p,519.0,519.0,20.0,BLEM EMB. PORCELAN. INC. DP45
2023-05-23T00:00:00Z,BLEM LIMPIA MP BT 800 ML/12/A,/Limpieza/Limpieza de Pisos y Muebles/Ceras y Autobrillos/,/Limpieza/Limpieza de Pisos y Muebles/,469638,https://www.hiperlibertad.com.ar/blem-limpia-mp-bt-800-ml-12-a/p,663.99,663.99,16.0,BLEM LIMPIA MP BT 800 ML/12/A
2023-05-23T00:00:00Z,BLEM LIMPIA MP DP 400 ML/15/A,/Limpieza/Limpieza de Pisos y Muebles/Ceras y Autobrillos/,/Limpieza/Limpieza de Pisos y Muebles/,469654,https://www.hiperlibertad.com.ar/blem-limpia-mp-dp-400-ml-15-a/p,418.0,418.0,56.0,BLEM LIMPIA MP DP 400 ML/15/A
2023-05-23T00:00:00Z,BLEM LIMPIA P F ALMENDRA BT80,/Limpieza/Limpieza de Pisos y Muebles/Ceras y Autobrillos/,/Limpieza/Limpieza de Pisos y Muebles/,469645,https://www.hiperlibertad.com.ar/blem-limpia-p-f-almendra-bt80/p,476.0,476.0,77.0,BLEM LIMPIA P F ALMENDRA BT80
2021-06-17T00:00:00Z,BLEM LISTO LIMPI MP V L BT800,/Limpieza/Limpieza de Pisos y Muebles/Ceras y Autobrillos/,/Limpieza/Limpieza de Pisos y Muebles/,469637,https://www.hiperlibertad.com.ar/blem-listo-limpi-mp-v-l-bt800/p,251.99,503.0,14.0,BLEM LISTO LIMPI MP V L BT800
2023-05-23T00:00:00Z,BLEM LISTO LIMPI P F A P BT80,/Limpieza/Limpieza de Pisos y Muebles/Ceras y Autobrillos/,/Limpieza/Limpieza de Pisos y Muebles/,469636,https://www.hiperlibertad.com.ar/blem-listo-limpi-p-f-a-p-bt80/p,537.99,537.99,67.0,BLEM LISTO LIMPI P F A P BT80
2023-05-23T00:00:00Z,CERAMICOL AUTOBRILLO INC BT80,/Limpieza/Limpieza de Pisos y Muebles/Ceras y Autobrillos/,/Limpieza/Limpieza de Pisos y Muebles/,469639,https://www.hiperlibertad.com.ar/ceramicol-autobrillo-inc-bt80/p,580.0,580.0,21.0,CERAMICOL AUTOBRILLO INC BT80
2023-05-23T00:00:00Z,CERAMICOL AUTOBRILLO INC DP45,/Limpieza/Limpieza de Pisos y Muebles/Ceras y Autobrillos/,/Limpieza/Limpieza de Pisos y Muebles/,469658,https://www.hiperlibertad.com.ar/ceramicol-autobrillo-inc-dp45/p,300.0,300.0,95.0,CERAMICOL AUTOBRILLO INC DP45
2023-05-23T00:00:00Z,CERAMICOL AUTOBRILLO ROJ BT80,/Limpieza/Limpieza de Pisos y Muebles/Ceras y Autobrillos/,/Limpieza/Limpieza de Pisos y Muebles/,469640,https://www.hiperlibertad.com.ar/ceramicol-autobrillo-roj-bt80/p,580.0,580.0,19.0,CERAMICOL AUTOBRILLO ROJ BT80
2023-05-29T00:00:00Z,Cera autobrillo Blem incolora bidon 5 Lt,/Limpieza/Limpieza de Pisos y Muebles/Ceras y Autobrillos/,/Limpieza/Limpieza de Pisos y Muebles/,365685,https://www.hiperlibertad.com.ar/cera-autobrillo-blem-incolora-bidon-5-lt/p,3149.99,3149.99,13.0,Cera autobrillo Blem incolora bidon 5 Lt
2023-05-23T00:00:00Z,DESINF PISOS LYSOF BEBEDPX420,/Limpieza/Limpieza de Pisos y Muebles/Limpiadores de Piso/,/Limpieza/Limpieza de Pisos y Muebles/,452635,https://www.hiperlibertad.com.ar/desinf-pisos-lysof-bebedpx420/p,249.0,249.0,18.0,DESINF PISOS LYSOF BEBEDPX420
2023-05-23T00:00:00Z,DETTOL LIMON X1800ML,/Limpieza/Limpieza de Pisos y Muebles/Limpiadores de Piso/,/Limpieza/Limpieza de Pisos y Muebles/,432212,https://www.hiperlibertad.com.ar/liquido-desinfectante-para-pisos-dettol-espadol-x-1-8-lts/p,455.37,455.37,3.0,DETTOL LIMON X1800ML
2023-05-29T00:00:00Z,Desinfectante Lysol Líquido Para Pisos Original X 900 Ml,/Limpieza/Limpieza de Pisos y Muebles/Limpiadores de Piso/,/Limpieza/Limpieza de Pisos y Muebles/,363220,https://www.hiperlibertad.com.ar/desinfectante-espadol-liquido-para-pisos-original-900-ml/p,324.99,324.99,10.0,Desinfectante Lysol Líquido Para Pisos Original X 900 Ml
2023-05-23T00:00:00Z,ECHO LISTO LAVANDA BT 800 ML/,/Limpieza/Limpieza de Pisos y Muebles/Ceras y Autobrillos/,/Limpieza/Limpieza de Pisos y Muebles/,469643,https://www.hiperlibertad.com.ar/echo-listo-lavanda-bt-800-ml/p,448.99,448.99,19.0,ECHO LISTO LAVANDA BT 800 ML/
2023-05-23T00:00:00Z,"LIM.LIQ.POETT DES.ALEGRATD1,8",/Limpieza/Limpieza de Pisos y Muebles/Limpiadores de Piso/,/Limpieza/Limpieza de Pisos y Muebles/,469007,https://www.hiperlibertad.com.ar/lim-liq-poett-des-alegratd1-8/p,456.0,456.0,7.0,"LIM.LIQ.POETT DES.ALEGRATD1,8"
2023-05-23T00:00:00Z,LIM.LIQ.POETT.DES.MUSICA.P1.8,/Limpieza/Limpieza de Pisos y Muebles/Limpiadores de Piso/,/Limpieza/Limpieza de Pisos y Muebles/,469005,https://www.hiperlibertad.com.ar/lim-liq-poett-des-musica-p1-8/p,456.0,456.0,63.0,LIM.LIQ.POETT.DES.MUSICA.P1.8
2023-05-23T00:00:00Z,INDIVIDUALES FELPITA 1 X 70 U,/Limpieza/Papeles/Rollos de Cocina/,/Limpieza/Papeles/,482371,https://www.hiperlibertad.com.ar/individuales-felpita-1-x-70-u/p,765.99,765.99,5.0,INDIVIDUALES FELPITA 1 X 70 U
