Fecha_de_publicacion,Nombre_del_producto,Categoria,Subcategoria,Codigo_del_producto,URL,Precio_publicado,Precio_regular,Stock,Descripcion
2023-05-29T00:00:00Z,Alfajor Terrabusi dulce de leche 70 g.,/Almacén/Golosinas y Chocolates/Alfajores/,/Almacén/Golosinas y Chocolates/,122549,https://www.hiperlibertad.com.ar/alfajor-terrabusi-dulce-de-leche-70-g/p,255.99,255.99,2528.0,Alfajor Terrabusi dulce de leche 70 g.
2023-05-29T00:00:00Z,Alfajores Terrabusi chocolate clasico 300 Gr,/Almacén/Golosinas y Chocolates/Alfajores/,/Almacén/Golosinas y Chocolates/,271860,https://www.hiperlibertad.com.ar/alfajores-terrabusi-chocolate-clasico-300-gr/p,917.0,917.0,14.0,Alfajores Terrabusi chocolate clasico 300 Gr
2023-05-29T00:00:00Z,Almohadon p/ silla Cloe 40x40- NEGRO,/Almacén/Golosinas y Chocolates/Caramelos y Chicles/,/Almacén/Golosinas y Chocolates/,440909,https://www.hiperlibertad.com.ar/almohadon-p-silla-cloe-40x40-negro/p,114.0,114.0,67.0,
2023-05-29T00:00:00Z,BARRA ARROZ NEGRA CACHAFAZ X1U,/Almacén/Golosinas y Chocolates/Caramelos y Chicles/,/Almacén/Golosinas y Chocolates/,388469,https://www.hiperlibertad.com.ar/barra-arroz-negra-cachafaz-1-u/p,150.99,150.99,29.0,BARRA ARROZ NEGRA CACHAFAZ X1U
2023-05-29T00:00:00Z,BARRA DE CHOCOLATE KINDER MAXI X 21 GR,/Almacén/Golosinas y Chocolates/Chocolates/,/Almacén/Golosinas y Chocolates/,149968,https://www.hiperlibertad.com.ar/barra-de-chocolate-kinder-maxi-x-21-gr/p,146.99,146.99,87.0,BARRA DE CHOCOLATE KINDER MAXI X 21 GR
2023-05-23T00:00:00Z,BARRA DE CHOCOLATE VIZZIO CON MANI X 85 Gr,/Almacén/Golosinas y Chocolates/Chocolates/,/Almacén/Golosinas y Chocolates/,476709,https://www.hiperlibertad.com.ar/barra-de-chocolate-vizzio-con-mani-x-85-gr/p,383.99,383.99,77.0,BARRA DE CHOCOLATE VIZZIO CON MANI X 85 Gr
2023-05-18T00:00:00Z,ALMID�N DE MA�Z MAIZENA X 550 G.,/Almacén/Harinas/Harinas Comunes y Leudantes/,/Almacén/Harinas/,481564,https://www.hiperlibertad.com.ar/almidon-de-maiz-maizena-x-550-gr/p,465.0,465.0,44.0,ALMID�N DE MA�Z MAIZENA X 550 G.
2023-05-23T00:00:00Z,GRANOLA MAIZENA CON ALMENDRAS Y ARANDANOS X 250 Gr,/Almacén/Harinas/Harinas Comunes y Leudantes/,/Almacén/Harinas/,495997,https://www.hiperlibertad.com.ar/granola-maizena-con-almendras-y-arandanos-x-250-gr/p,701.99,993.99,62.0,GRANOLA MAIZENA CON ALMENDRAS Y ARANDANOS X 250 Gr
2023-05-23T00:00:00Z,GRANOLA MAIZENA CON COCO Y SEMILLAS X 250 Gr,/Almacén/Harinas/Harinas Comunes y Leudantes/,/Almacén/Harinas/,495998,https://www.hiperlibertad.com.ar/granola-maizena-con-coco-y-semillas-x-250-gr/p,701.99,993.99,78.0,GRANOLA MAIZENA CON COCO Y SEMILLAS X 250 Gr
2023-05-23T00:00:00Z,Galletas rellenas Smams Relleno Chocolate x 105 gr,/Almacén/Harinas/Avenas y Sémolas/,/Almacén/Harinas/,496517,https://www.hiperlibertad.com.ar/galletas-rellenas-smams-relleno-chocolate-x-105-gr/p,290.0,290.0,2.0,Galletas rellenas Smams Relleno Chocolate x 105 gr
2023-05-23T00:00:00Z,Granola Maizena arandanos y almendras x 180 gr,/Almacén/Harinas/Harinas Comunes y Leudantes/,/Almacén/Harinas/,495996,https://www.hiperlibertad.com.ar/granola-maizena-arandanos-y-almendras-x-180-gr/p,548.99,769.99,6.0,Granola Maizena arandanos y almendras x 180 gr
2023-05-23T00:00:00Z,Granola Maizena coco y semillas x 180 gr,/Almacén/Harinas/Harinas Comunes y Leudantes/,/Almacén/Harinas/,496227,https://www.hiperlibertad.com.ar/granola-maizena-coco-y-semillas-x-180-gr/p,548.99,769.99,38.0,Granola Maizena coco y semillas x 180 gr
2023-05-23T00:00:00Z,HARINA 0000 PUREZA ULTRA REFINADA 1KG,/Almacén/Harinas/Harinas Comunes y Leudantes/,/Almacén/Harinas/,472337,https://www.hiperlibertad.com.ar/harina-0000-pureza-ultra-refinada-1kg/p,228.0,228.0,262.0,HARINA 0000 PUREZA ULTRA REFINADA 1KG
2023-05-23T00:00:00Z,HARINA DE MAIZ PRESTOPRONTA PARA AREPAS X 1 Kg,/Almacén/Harinas/Polentas/,/Almacén/Harinas/,479196,https://www.hiperlibertad.com.ar/harina-de-maiz-prestopronta-para-arepas-x-1-kg/p,509.03,509.03,107.0,HARINA DE MAIZ PRESTOPRONTA PARA AREPAS X 1 Kg
2023-05-23T00:00:00Z,HARINA MOL.CHACABUCO 000 X1KG,/Almacén/Harinas/Harinas Comunes y Leudantes/,/Almacén/Harinas/,458012,https://www.hiperlibertad.com.ar/harina-mol-chacabuco-000-x1kg/p,164.77,164.77,387.0,HARINA MOL.CHACABUCO 000 X1KG
2023-05-23T00:00:00Z,HARINA PARA AREPAS MORIXE,/Almacén/Harinas/Polentas/,/Almacén/Harinas/,455394,https://www.hiperlibertad.com.ar/harina-para-arepas-morixe/p,469.0,469.0,28.0,HARINA PARA AREPAS MORIXE
2023-05-23T00:00:00Z,PREMEZCLA PARA PIZZA ARCOR LIBRE DE GLUTEN X 500 Gr,/Almacén/Harinas/Premezclas/,/Almacén/Harinas/,447426,https://www.hiperlibertad.com.ar/premezcla-para-pizza-arcor-libre-de-gluten-x-500-gr/p,555.49,555.49,105.0,PREMEZCLA PARA PIZZA ARCOR LIBRE DE GLUTEN X 500 Gr
2023-05-23T00:00:00Z,PREMEZCLA PARA ÑOQUIS ARCOR LIBRE DE GLUTEN X 400 Gr,/Almacén/Harinas/Premezclas/,/Almacén/Harinas/,447427,https://www.hiperlibertad.com.ar/premezcla-para-oquis-arcor-libre-de-gluten-x-400-gr/p,332.49,332.49,104.0,PREMEZCLA PARA ÑOQUIS ARCOR LIBRE DE GLUTEN X 400 Gr
2023-05-23T00:00:00Z,PREMEZCLA PIZZA LUCCHETTI X850G,/Almacén/Harinas/Premezclas/,/Almacén/Harinas/,465392,https://www.hiperlibertad.com.ar/premezcla-pizza-lucchetti-x850g/p,528.9,528.9,1.0,PREMEZCLA PIZZA LUCCHETTI X850G
2023-05-23T00:00:00Z,PURE DE MANZANA GERBER X 113 Gr,/Almacén/Harinas/Avenas y Sémolas/,/Almacén/Harinas/,456717,https://www.hiperlibertad.com.ar/pure-de-manzana-gerber-x-113-gr/p,332.99,332.99,23.0,PURE DE MANZANA GERBER X 113 Gr
2023-05-23T00:00:00Z,PURE PAPAS KNORR RECETA COMPLETA X 125 Gr,/Almacén/Harinas/Premezclas/,/Almacén/Harinas/,498141,https://www.hiperlibertad.com.ar/pure-papas-knorr-receta-completa-x-125-gr/p,370.99,370.99,10.0,PURE PAPAS KNORR RECETA COMPLETA X 125 Gr
2023-05-23T00:00:00Z,Polenta Prestopronta 500 Gr,/Almacén/Harinas/Polentas/,/Almacén/Harinas/,60060,https://www.hiperlibertad.com.ar/polenta-prestopronta-500-gr/p,250.0,330.0,792.0,Polenta Prestopronta 500 Gr
2023-05-23T00:00:00Z,Polenta Prestopronta Panceta y Queso x 250 Gr,/Almacén/Harinas/Polentas/,/Almacén/Harinas/,441975,https://www.hiperlibertad.com.ar/polenta-prestopronta-panceta-y-queso-x-250-gr/p,180.49,180.49,21.0,Polenta Prestopronta Panceta y Queso x 250 Gr
2023-05-23T00:00:00Z,Polenta saborizada Presto Pronta espinaca a la crema 250 Gr,/Almacén/Harinas/Polentas/,/Almacén/Harinas/,441973,https://www.hiperlibertad.com.ar/polenta-saborizada-presto-pronta-espinaca-a-la-crema-250-gr/p,180.49,180.49,36.0,Polenta saborizada Presto Pronta espinaca a la crema 250 Gr
2023-05-29T00:00:00Z,Premezcla Para Chipa Mamá Cocina 250 Gr,/Almacén/Harinas/Premezclas/,/Almacén/Harinas/,363520,https://www.hiperlibertad.com.ar/premezcla-para-chipa-mama-cocina-250-gr/p,459.0,459.0,13.0,Premezcla Para Chipa Mamá Cocina 250 Gr
2023-05-29T00:00:00Z,VITINA LUCCHET VEGETALES X 250 Gr,/Almacén/Harinas/Avenas y Sémolas/,/Almacén/Harinas/,358983,https://www.hiperlibertad.com.ar/vitina-lucchet-vegetales-x-250-gr/p,339.0,339.0,18.0,VITINA LUCCHET VEGETALES X 250 Gr
2023-05-29T00:00:00Z,Vitina Clásica Luchetti Con Calcio 250 Gr,/Almacén/Harinas/Avenas y Sémolas/,/Almacén/Harinas/,358982,https://www.hiperlibertad.com.ar/vitina-clasica-luchetti-con-calcio-250-gr/p,294.0,294.0,54.0,Vitina Clásica Luchetti Con Calcio 250 Gr
2023-05-29T00:00:00Z,Vitina Clásica Luchetti Con Calcio 500 Gr,/Almacén/Harinas/Avenas y Sémolas/,/Almacén/Harinas/,358980,https://www.hiperlibertad.com.ar/vitina-clasica-luchetti-con-calcio-500-gr/p,465.41,465.41,15.0,Vitina Clásica Luchetti Con Calcio 500 Gr
2023-05-29T00:00:00Z,Vitina Luchetti Espinaca Con Calcio 250 Gr,/Almacén/Harinas/Avenas y Sémolas/,/Almacén/Harinas/,358981,https://www.hiperlibertad.com.ar/vitina-luccheti-espinaca-x-250-gr/p,338.0,338.0,18.0,Vitina Luchetti Espinaca Con Calcio 250 Gr
2023-05-29T00:00:00Z,ARROZ LUCCHETTI LF 00000 X500G,/Almacén/Arroz y Legumbres/Arroz/,/Almacén/Arroz y Legumbres/,327278,https://www.hiperlibertad.com.ar/arroz-largo-fino-lucchetti-500gr/p,166.0,166.0,701.0,ARROZ LUCCHETTI LF 00000 X500G
2023-05-29T00:00:00Z,AZUCAR HILERET LIGHT X500 Gr,/Almacén/Desayuno y Merienda/Azucar y Edulcorantes/,/Almacén/Desayuno y Merienda/,1012,https://www.hiperlibertad.com.ar/azucar-hileret-light-x500-gr/p,508.0,508.0,533.0,Azucar Hileret light x 500 Gr  Libre de Gluten 50% menos calor&iacute;as que el az&uacute;car com&uacute;n Apto para cocinar
2023-05-29T00:00:00Z,Aceite Fritolim Clasico  En Aerosol 120 Gr,/Almacén/Aceites y Vinagres/Aceites en Aerosol/,/Almacén/Aceites y Vinagres/,344608,https://www.hiperlibertad.com.ar/aceite-fritolim-clasico-en-aerosol-120-gr/p,461.0,461.0,53.0,Aerosol Fritolim Aceite Clasico x 120 Gr
2023-05-29T00:00:00Z,Arroz Gallo Doble Carolina X500G.,/Almacén/Arroz y Legumbres/Arroz/,/Almacén/Arroz y Legumbres/,345319,https://www.hiperlibertad.com.ar/arroz-gallo-doble-carolina-x500g/p,304.4,304.4,6.0,Arroz Gallo Doble Carolina X500G.
2023-05-29T00:00:00Z,Arroz doble carolina Gallo 1 Kg,/Almacén/Arroz y Legumbres/Arroz/,/Almacén/Arroz y Legumbres/,345311,https://www.hiperlibertad.com.ar/arroz-doble-carolina-gallo-1-kg/p,517.0,517.0,257.0,Arroz doble carolina Gallo 1 Kg
2023-05-29T00:00:00Z,BIZC DE ARROZ GALLO DULCE 50G,/Almacén/Desayuno y Merienda/Galletitas saladas/,/Almacén/Desayuno y Merienda/,347877,https://www.hiperlibertad.com.ar/bizcochos-de-arroz-dulces-gallo-50-gr/p,108.0,108.0,167.0,Bizcochos de arroz dulces Gallo 50 Gr
2023-05-29T00:00:00Z,BIZCOCHITOS SABOR QUESO S/TACCX 100 GR,/Almacén/Sin Tacc/,/Almacén/,320095,https://www.hiperlibertad.com.ar/bizcochitos-sabor-queso-s-taccx-100-gr/p,293.99,293.99,12.0,BIZCOCHITOS SABOR QUESO S/TACCX 100 GR
2023-05-29T00:00:00Z,Bizcochitos Salados Sin TACC x 100 Gr,/Almacén/Desayuno y Merienda/Galletitas saladas/,/Almacén/Desayuno y Merienda/,151700,https://www.hiperlibertad.com.ar/bizcochitos-salados-sin-tacc-x-100-gr/p,269.99,269.99,2.0,Bizcochitos Salados Sin TACC x 100 Gr
2023-05-29T00:00:00Z,Bizcochos de arroz salados Gallo 100 Gr,/Almacén/Desayuno y Merienda/Galletitas saladas/,/Almacén/Desayuno y Merienda/,335454,https://www.hiperlibertad.com.ar/bizcochos-de-arroz-salados-gallo-100-gr/p,234.0,234.0,22.0,Bizcochos de arroz salados Gallo 100 Gr
2023-05-29T00:00:00Z,Budín Marmolado Sin TACC X 185 Gr,"/Almacén/Desayuno y Merienda/Bizcochuelos, budines y magdalenas/",/Almacén/Desayuno y Merienda/,27957,https://www.hiperlibertad.com.ar/budin-marmolado-sin-tacc-x-185-gr/p,659.0,659.0,15.0,Budín Marmolado Sin TACC X 185 Gr
2023-05-29T00:00:00Z,Budín de Vainilla Sin TACC X 185 Gr,"/Almacén/Desayuno y Merienda/Bizcochuelos, budines y magdalenas/",/Almacén/Desayuno y Merienda/,279569,https://www.hiperlibertad.com.ar/budin-de-vainilla-sin-tacc-x-185-gr/p,638.99,638.99,11.0,Budín de Vainilla Sin TACC X 185 Gr
2023-05-23T00:00:00Z,CINTAS C/ SEMILLAS TAEQ X100G,/Almacén/Sin Tacc/,/Almacén/,465164,https://www.hiperlibertad.com.ar/cintas-taeq-con-semillas-taeq-stacc/p,179.0,235.0,251.0,CINTAS C/ SEMILLAS TAEQ X100G
2023-05-23T00:00:00Z,CINTAS CLASICAS TAEQ X 100 GR,/Almacén/Sin Tacc/,/Almacén/,465163,https://www.hiperlibertad.com.ar/cintas-taeq-clasicas-taeq-stacc/p,179.0,225.0,307.0,CINTAS CLASICAS TAEQ X 100 GR
2023-05-23T00:00:00Z,CRACKER C/MIX DE SEMILLAS. X 75 GR,/Almacén/Sin Tacc/,/Almacén/,464357,https://www.hiperlibertad.com.ar/cracker-c-mix-de-semillas-x-75-gr/p,269.99,269.99,6.0,CRACKER C/MIX DE SEMILLAS. X 75 GR
2023-05-23T00:00:00Z,Cereales Snuks Bolitas de Chocolate x 200 Gr,/Almacén/Sin Tacc/,/Almacén/,496974,https://www.hiperlibertad.com.ar/cereales-snuks-bolitas-de-chocolate-x-200-gr/p,552.0,552.0,3.0,Cereales Snuks Bolitas de Chocolate x 200 Gr
2023-05-29T00:00:00Z,FIDEOS WAKAS GARB Y CHIA X250G,/Almacén/Sin Tacc/,/Almacén/,456573,https://www.hiperlibertad.com.ar/fideos-wakas-garb-y-chia-x250g/p,605.0,605.0,5.0,FIDEOS WAKAS GARB Y CHIA X250G
2023-05-23T00:00:00Z,Fideos fusilli Wakas multicereal kale sin TACC 250 g,/Almacén/Sin Tacc/,/Almacén/,456571,https://www.hiperlibertad.com.ar/fideos-fusilli-wakas-multicereal-kale-sin-tacc-250-g/p,427.99,427.99,11.0,Fideos fusilli Wakas multicereal kale sin TACC 250 g
2023-05-23T00:00:00Z,LECHE LS UAT ENT 3% BRIK,/Lácteos/Leches/Larga Vida/,/Lácteos/Leches/,438906,https://www.hiperlibertad.com.ar/leche-entera-clasica-la-serenisima-larga-vida-1l/p,404.99,404.99,126.0,LECHE LS UAT ENT 3% BRIK
2023-05-23T00:00:00Z,PAN MOLDE SIN TACC SIN LECHE,/Almacén/Sin Tacc/,/Almacén/,463883,https://www.hiperlibertad.com.ar/pan-de-molde-taeq-200gr/p,799.0,799.0,3.0,PAN MOLDE SIN TACC SIN LECHE
2023-05-23T00:00:00Z,PREMEZCLA BIZCOCHUELO CHOCOLATE TAEQ 480GR,/Almacén/Sin Tacc/,/Almacén/,464226,https://www.hiperlibertad.com.ar/premezcla-bizcochuelo-chocolate-taeq-480gr/p,291.34,291.34,67.0,PREMEZCLA BIZCOCHUELO CHOCOLATE TAEQ 480GR
2023-05-23T00:00:00Z,PREMEZCLA BIZCOCHUELO VAINILLA TAEQ 480GR,/Almacén/Sin Tacc/,/Almacén/,464158,https://www.hiperlibertad.com.ar/premezcla-bizcochuelo-vainilla-taeq-480gr/p,256.38,256.38,32.0,PREMEZCLA BIZCOCHUELO VAINILLA TAEQ 480GR
2023-05-23T00:00:00Z,PREMEZCLA PANIFICADOS Y REPOSTERÍA TAEQ 500GR,/Almacén/Sin Tacc/,/Almacén/,463905,https://www.hiperlibertad.com.ar/premezcla-panificados-y-reposteria-taeq-500gr/p,899.0,899.0,4.0,PREMEZCLA PANIFICADOS Y REPOSTERÍA TAEQ 500GR
2023-05-23T00:00:00Z,PREMEZCLA PIZZA STACCTAEQX500G,/Almacén/Sin Tacc/,/Almacén/,464183,https://www.hiperlibertad.com.ar/premezcla-pizza-taeq-500gr/p,989.0,989.0,301.0,PREMEZCLA PIZZA STACCTAEQX500G
2023-05-29T00:00:00Z,Palitos de Arroz Dos Hermanos Queso 80 G,/Almacén/Snacks/Mix/,/Almacén/Snacks/,363530,https://www.hiperlibertad.com.ar/palitos-de-arroz-dos-hermanos-queso-80-g/p,260.0,312.0,139.0,Palitos de Arroz Dos Hermanos Sabor Queso 80 Gr
2023-05-23T00:00:00Z,BIZCOCHUELO RECTANGULAR 3 CAPAS VAINILLA X 450GR,/Almacén/Panificados/Elaboración Propia/,/Almacén/Panificados/,466739,https://www.hiperlibertad.com.ar/bizcochuelo-rectangular-3-capas-vainilla-x-450gr/p,968.0,968.0,10.0,BIZCOCHUELO RECTANGULAR 3 CAPAS VAINILLA X 450GR
2023-05-29T00:00:00Z,BIZCOCHUELO RECTANGULAR 3 CAPAS VAINILLA X 750GR,/Almacén/Panificados/Elaboración Propia/,/Almacén/Panificados/,319304,https://www.hiperlibertad.com.ar/bizcochuelo-rectangular-3-capas-vainilla-x-750gr/p,1515.99,1515.99,38.0,BIZCOCHUELO RECTANGULAR 3 CAPAS VAINILLA X 750GR
2023-05-23T00:00:00Z,BUDIN DE CHOCOLATE X U,/Almacén/Panificados/Elaboración Propia/,/Almacén/Panificados/,480069,https://www.hiperlibertad.com.ar/budin-de-chocolate-x-u/p,519.0,519.0,63.0,BUDIN DE CHOCOLATE X U
2023-05-29T00:00:00Z,BUDIN DE CHOCOLATE X UN C/CPC PAIS,/Almacén/Panificados/Elaboración Propia/,/Almacén/Panificados/,262847,https://www.hiperlibertad.com.ar/budin-de-chocolate-x-un-c-cpc-pais/p,519.0,519.0,64.0,BUDIN DE CHOCOLATE X UN C/CPC PAIS
2023-05-23T00:00:00Z,BUDIN DE VAINILLA X U,/Almacén/Panificados/Elaboración Propia/,/Almacén/Panificados/,480071,https://www.hiperlibertad.com.ar/budin-de-vainilla-x-u/p,519.0,519.0,116.0,BUDIN DE VAINILLA X U
2023-05-29T00:00:00Z,BUDIN DE VAINILLA X UN C/CPC PAIS,/Almacén/Panificados/Elaboración Propia/,/Almacén/Panificados/,262843,https://www.hiperlibertad.com.ar/budin-de-vainilla-x-un-c-cpc-pais/p,519.0,519.0,117.0,BUDIN DE VAINILLA X UN C/CPC PAIS
2023-05-23T00:00:00Z,BUDIN MARMOLADO X U,/Almacén/Panificados/Elaboración Propia/,/Almacén/Panificados/,480073,https://www.hiperlibertad.com.ar/budin-marmolado-x-u/p,519.0,519.0,129.0,BUDIN MARMOLADO X U
2023-05-29T00:00:00Z,BUDIN MARMOLADO X UN C/CPC PAIS,/Almacén/Panificados/Elaboración Propia/,/Almacén/Panificados/,262846,https://www.hiperlibertad.com.ar/budin-marmolado-x-un-c-cpc-pais/p,519.0,519.0,130.0,BUDIN MARMOLADO X UN C/CPC PAIS
2023-05-29T00:00:00Z,Bizcochuelo Rectangular de Chocolate 3 Capas X 500 Gr,/Almacén/Panificados/Elaboración Propia/,/Almacén/Panificados/,301032,https://www.hiperlibertad.com.ar/bizcochuelo-rectangular-de-chocolate-3-capas-x-500-gr/p,1175.99,1175.99,39.0,Bizcochuelo Rectangular de Chocolate 3 Capas X 500 Gr
2023-05-29T00:00:00Z,Bizcochuelo Rectangular de Vainilla 3 Capas X 500 Gr,/Almacén/Panificados/Elaboración Propia/,/Almacén/Panificados/,301030,https://www.hiperlibertad.com.ar/bizcochuelo-rectangular-de-vainilla-3-capas-x-500-gr/p,1065.99,1065.99,45.0,Bizcochuelo Rectangular de Vainilla 3 Capas X 500 Gr
2023-05-23T00:00:00Z,Budín Inglés x 160 Gr,/Almacén/Panificados/Elaboración Propia/,/Almacén/Panificados/,436839,https://www.hiperlibertad.com.ar/budin-ingles-x-160-gr/p,328.99,328.99,7.0,Budín Inglés x 160 Gr
2023-05-23T00:00:00Z,Budín Marmolado x 160 Gr,/Almacén/Panificados/Elaboración Propia/,/Almacén/Panificados/,436866,https://www.hiperlibertad.com.ar/budin-marmolado-x-160-gr/p,328.99,328.99,2.0,Budín Marmolado x 160 Gr
2023-05-23T00:00:00Z,Budín de Vainilla con Chips de Chocolate X 160 Gr,/Almacén/Panificados/Elaboración Propia/,/Almacén/Panificados/,436838,https://www.hiperlibertad.com.ar/budin-de-vainilla-con-chips-de-chocolate-x-160-gr/p,328.99,328.99,10.0,Budín de Vainilla con Chips de Chocolate X 160 Gr
2023-05-23T00:00:00Z,Budín de Vainilla x 160 Gr,/Almacén/Panificados/Elaboración Propia/,/Almacén/Panificados/,436837,https://www.hiperlibertad.com.ar/budin-de-vainilla-x-160-gr/p,328.99,328.99,15.0,Budín de Vainilla x 160 Gr
2023-05-23T00:00:00Z,CINTITAS ORGÁNICAS WALK CLÁSICAS CON SAL MARINA X 100 Gr,/Almacén/Panificados/Pan Lactal/,/Almacén/Panificados/,480823,https://www.hiperlibertad.com.ar/cintitas-org-nicas-walk-cl-sicas-con-sal-marina-x-100-gr/p,230.99,230.99,10.0,CINTITAS ORGÁNICAS WALK CLÁSICAS CON SAL MARINA X 100 Gr
2023-05-23T00:00:00Z,GALLETAS CINTITAS BARBACOA X 125 GRS,/Almacén/Panificados/Pan Lactal/,/Almacén/Panificados/,465400,https://www.hiperlibertad.com.ar/galletas-cintitas-barbacoa-x-125-grs/p,209.0,209.0,31.0,GALLETAS CINTITAS BARBACOA X 125 GRS
2023-05-23T00:00:00Z,GALLETAS CINTITAS CEBOLLAS X 125GR,/Almacén/Panificados/Pan Lactal/,/Almacén/Panificados/,465420,https://www.hiperlibertad.com.ar/galletas-cintitas-cebollas-x-125gr/p,209.0,209.0,1.0,GALLETAS CINTITAS CEBOLLAS X 125GR
2023-05-23T00:00:00Z,GALLETAS CINTITAS CHEDDAR X125GRS,/Almacén/Panificados/Pan Lactal/,/Almacén/Panificados/,465423,https://www.hiperlibertad.com.ar/galletas-cintitas-cheddar-x125grs/p,209.0,209.0,39.0,GALLETAS CINTITAS CHEDDAR X125GRS
2023-05-23T00:00:00Z,GALLETAS CINTITAS CLÀSICAS 125G,/Almacén/Panificados/Pan Lactal/,/Almacén/Panificados/,465399,https://www.hiperlibertad.com.ar/galletas-cintitas-cl-sicas-125g/p,209.0,209.0,48.0,GALLETAS CINTITAS CLÀSICAS 125G
2023-05-23T00:00:00Z,GALLETAS CINTITAS QUESO X 125 GR,/Almacén/Panificados/Pan Lactal/,/Almacén/Panificados/,465419,https://www.hiperlibertad.com.ar/galletas-cintitas-queso-x-125-gr/p,209.0,209.0,15.0,GALLETAS CINTITAS QUESO X 125 GR
2023-05-23T00:00:00Z,GALLETAS CINTITAS SEMILLA X 125GR,/Almacén/Panificados/Pan Lactal/,/Almacén/Panificados/,465422,https://www.hiperlibertad.com.ar/galletas-cintitas-semilla-x-125gr/p,209.0,209.0,61.0,GALLETAS CINTITAS SEMILLA X 125GR
2023-05-23T00:00:00Z,GALLETITAS CINTITAS PIZZA X 125GR,/Almacén/Panificados/Pan Lactal/,/Almacén/Panificados/,465425,https://www.hiperlibertad.com.ar/galletitas-cintitas-pizza-x-125gr/p,209.0,209.0,5.0,GALLETITAS CINTITAS PIZZA X 125GR
2023-05-23T00:00:00Z,GRISINES FIRENZE SALVADO X 200 GR,/Almacén/Panificados/Tostadas y Grisines/,/Almacén/Panificados/,89545,https://www.hiperlibertad.com.ar/grisines-firenze-salvado-x-200-gr/p,373.0,373.0,118.0,GRISINES FIRENZE SALVADO X 200 GR
2023-05-29T00:00:00Z,Grisin Multicereal Cormillot 180 Gr,/Almacén/Panificados/Tostadas y Grisines/,/Almacén/Panificados/,378428,https://www.hiperlibertad.com.ar/grisin-multicereal-cormillot-180-gr/p,161.0,161.0,84.0,Grisin Multicereal Cormillot 180 Gr
2022-02-11T00:00:00Z,BA�O REP. CELESTE AGUILA X150G,/Almacén/Para preparar/Bizcochuelos y Tortas/,/Almacén/Para preparar/,474286,https://www.hiperlibertad.com.ar/ba-o-rep-celeste-aguila-x150g/p,519.49,519.49,45.0,BA�O REP. CELESTE AGUILA X150G
2023-05-23T00:00:00Z,BIZC CH ARCOR SIN.TACC 500G.,/Almacén/Para preparar/Bizcochuelos y Tortas/,/Almacén/Para preparar/,446462,https://www.hiperlibertad.com.ar/bizcochuelo-arcor-de-chocolate-sin-tacc-x-500-gr/p,610.49,610.49,56.0,BIZC CH ARCOR SIN.TACC 500G.
2023-05-23T00:00:00Z,BIZCOCHUELO GODET CHOCOLATE X 480 Gr,/Almacén/Para preparar/Bizcochuelos y Tortas/,/Almacén/Para preparar/,474484,https://www.hiperlibertad.com.ar/bizcochuelo-godet-chocolate-x-480-gr/p,506.49,506.49,2.0,BIZCOCHUELO GODET CHOCOLATE X 480 Gr
2023-05-23T00:00:00Z,BIZCOCHUELO GODET MARMOLADO X 500 Gr,/Almacén/Para preparar/Bizcochuelos y Tortas/,/Almacén/Para preparar/,474483,https://www.hiperlibertad.com.ar/bizcochuelo-godet-marmolado-x-500-gr/p,572.49,572.49,135.0,BIZCOCHUELO GODET MARMOLADO X 500 Gr
2023-05-23T00:00:00Z,BIZCOCHUELO ROYAL CHOCOLATE X 500 GR,/Almacén/Para preparar/Bizcochuelos y Tortas/,/Almacén/Para preparar/,450624,https://www.hiperlibertad.com.ar/bizcochuelo-royal-chocolate-x-500-gr/p,481.99,481.99,52.0,BIZCOCHUELO ROYAL CHOCOLATE X 500 GR
2023-05-29T00:00:00Z,Baño de reposteria semiamargo Georgalos  150 Gr,/Almacén/Para preparar/Bizcochuelos y Tortas/,/Almacén/Para preparar/,20813,https://www.hiperlibertad.com.ar/ba-o-de-reposteria-semiamargo-georgalos-150-gr/p,487.0,487.0,58.0,Baño de reposteria semiamargo Georgalos  150 Gr
2023-05-23T00:00:00Z,Bizcochuelo Aguila Torta 450 Gr,/Almacén/Para preparar/Bizcochuelos y Tortas/,/Almacén/Para preparar/,430529,https://www.hiperlibertad.com.ar/bizcochuelo-aguila-torta-450-gr/p,374.49,374.49,189.0,TORTA AGUILA 12X450 G
2023-05-23T00:00:00Z,Bizcochuelo EXQUISITA 1 minuto vainilla x55 g,/Almacén/Para preparar/Bizcochuelos y Tortas/,/Almacén/Para preparar/,464524,https://www.hiperlibertad.com.ar/bizcochuelo-exquisita-1-minuto-vainilla-x55-g/p,205.0,205.0,10.0,Bizcochuelo EXQUISITA 1 minuto vainilla x55 g
2023-05-29T00:00:00Z,Bizcochuelo Exquisita Chocolate Especial 540 Gr,/Almacén/Para preparar/Bizcochuelos y Tortas/,/Almacén/Para preparar/,301803,https://www.hiperlibertad.com.ar/bizcochuelo-exquisita-chocolate-especial-540-gr/p,458.93,458.93,34.0,Bizcochuelo Exquisita Chocolate Especial 540 Gr
2023-05-29T00:00:00Z,Bizcochuelo Exquisita coco 540 Gr,/Almacén/Para preparar/Bizcochuelos y Tortas/,/Almacén/Para preparar/,356907,https://www.hiperlibertad.com.ar/bizcochuelo-exquisita-coco-540-gr/p,459.0,459.0,6.0,Bizcochuelo Exquisita coco 540 Gr
2023-05-23T00:00:00Z,Brownie Aguila 425 Gr,/Almacén/Para preparar/Bizcochuelos y Tortas/,/Almacén/Para preparar/,430527,https://www.hiperlibertad.com.ar/brownie-aguila-425-gr/p,431.49,431.49,178.0,Brownie Aguila 425 Gr
2023-05-23T00:00:00Z,EXQ BIZC 1 MIN LIMON,/Almacén/Para preparar/Bizcochuelos y Tortas/,/Almacén/Para preparar/,492093,https://www.hiperlibertad.com.ar/exq-bizc-1-min-limon/p,156.0,156.0,136.0,EXQ BIZC 1 MIN LIMON
2023-05-23T00:00:00Z,FLAN ARCOR GODET DULCE DE LECHE X 30 Gr,/Almacén/Para preparar/Flanes/,/Almacén/Para preparar/,474452,https://www.hiperlibertad.com.ar/flan-arcor-godet-dulce-de-leche-x-30-gr/p,120.49,120.49,858.0,FLAN ARCOR GODET DULCE DE LECHE X 30 Gr
2023-05-23T00:00:00Z,FLAN EXQUISITA DULCE DE LECHE X 40 Gr,/Almacén/Para preparar/Flanes/,/Almacén/Para preparar/,478565,https://www.hiperlibertad.com.ar/flan-exquisita-dulce-de-leche-x-40-gr/p,109.0,109.0,242.0,FLAN EXQUISITA DULCE DE LECHE X 40 Gr
2023-05-23T00:00:00Z,FLAN EXQUISITA VAINILLA X 40 Gr,/Almacén/Para preparar/Flanes/,/Almacén/Para preparar/,478564,https://www.hiperlibertad.com.ar/flan-exquisita-vainilla-x-40-gr/p,109.0,109.0,33.0,FLAN EXQUISITA VAINILLA X 40 Gr
2023-05-23T00:00:00Z,FLAN GODET VAINILLA X 25 Gr,/Almacén/Para preparar/Flanes/,/Almacén/Para preparar/,474451,https://www.hiperlibertad.com.ar/flan-godet-vainilla-x-25-gr/p,129.49,129.49,358.0,FLAN GODET VAINILLA X 25 Gr
2023-05-23T00:00:00Z,FLAN ROYAL VAINILLA X 60 Gr,/Almacén/Para preparar/Flanes/,/Almacén/Para preparar/,503412,https://www.hiperlibertad.com.ar/flan-royal-vainilla-x-60-gr/p,97.0,97.0,41.0,FLAN ROYAL VAINILLA X 60 Gr
2023-05-23T00:00:00Z,GEL FRUTILLA GODET X25.GR,/Almacén/Para preparar/Gelatinas/,/Almacén/Para preparar/,484790,https://www.hiperlibertad.com.ar/gelatina-godet-frutilla-x-25-gr/p,207.49,207.49,264.0,GEL FRUTILLA GODET X25.GR
2022-02-11T00:00:00Z,GEL.CEREZA.LIGHT.BC.X20.G,/Almacén/Para preparar/Gelatinas/,/Almacén/Para preparar/,474467,https://www.hiperlibertad.com.ar/gel-cereza-light-bc-x20-g/p,173.0,173.0,267.0,GEL.CEREZA.LIGHT.BC.X20.G
2023-05-23T00:00:00Z,GEL.DURAZNO.LIGHT.BC.X20.G,/Almacén/Para preparar/Gelatinas/,/Almacén/Para preparar/,474296,https://www.hiperlibertad.com.ar/gelatina-light-bc-durazno-x-20-gr/p,231.49,231.49,234.0,GEL.DURAZNO.LIGHT.BC.X20.G
2023-05-23T00:00:00Z,GEL.FRUT MOGUL.X25GR.,/Almacén/Para preparar/Gelatinas/,/Almacén/Para preparar/,484791,https://www.hiperlibertad.com.ar/gelatina-mogul-frutilla-x-25-gr/p,213.49,213.49,325.0,GEL.FRUT MOGUL.X25GR.
2023-05-23T00:00:00Z,GELATINA EXQUISITA CEREZA X 40 Gr,/Almacén/Para preparar/Gelatinas/,/Almacén/Para preparar/,475447,https://www.hiperlibertad.com.ar/gelatina-exquisita-cereza-x-40-gr/p,147.0,147.0,29.0,GELATINA EXQUISITA CEREZA X 40 Gr
2023-05-23T00:00:00Z,GELATINA EXQUISITA DURAZNO X 40 Gr,/Almacén/Para preparar/Gelatinas/,/Almacén/Para preparar/,475448,https://www.hiperlibertad.com.ar/gelatina-exquisita-durazno-x-40-gr/p,162.07,162.07,189.0,GELATINA EXQUISITA DURAZNO X 40 Gr
2023-05-23T00:00:00Z,GELATINA EXQUISITA FRAMBUESA X 40 Gr,/Almacén/Para preparar/Gelatinas/,/Almacén/Para preparar/,475464,https://www.hiperlibertad.com.ar/gelatina-exquisita-frambuesa-x-40-gr/p,180.0,180.0,54.0,GELATINA EXQUISITA FRAMBUESA X 40 Gr
2023-05-23T00:00:00Z,CAPELETTINI GIACOMO CARNE X 500 GR,/Almacén/Pastas Secas y Salsas/Pastas Listas/,/Almacén/Pastas Secas y Salsas/,477759,https://www.hiperlibertad.com.ar/capelettini-giacomo-carne-x-500-gr/p,830.99,830.99,20.0,CAPELETTINI GIACOMO CARNE X 500 GR
